Start Time (s),Duration (s),Text
1241.28,3.639,पहुंचा दूंगा कोई ऐसी मसले की बात नहीं है
1243.12,6.36,थैंक यू सो मच थैंक यू सो मच
1244.919,4.561,रम थैंक यू सो मच
1252.29,3.1,[संगीत]
1264.919,5.76,अगर तुमने मेरी मां के बारे में दोबारा यह
1267.039,7.12,लज इस्तेमाल किया तो मुझसे कोई नहीं हो
1270.679,3.48,समझ तुम
1276.11,12.749,[संगीत]
1292.09,7.07,[संगीत]
1308.89,4.049,[संगीत]
1316.86,5.08,[संगीत]
1323.48,9.4,ओह इनसे मिलो यह है समीन की ताय जान बड़ी
1328.12,4.76,लाडली है जमीन इनकी जान छिड़क है जमीन
1335.44,4.04,पर सलाम
1337.73,6.35,[संगीत]
1339.48,11.92,वालेकुम तेरी जात में ही छुपी मेरी ही
1344.08,7.32,कहानी है जिक्र तेरा याद रहे आखों
1353.279,6.0,में बस
1355.48,7.319,बस बहुत शुक्रिया बेटा खामखा जहमत की
1359.279,7.441,तुमने आओ ना अंदर आओ नहीं नहीं मैं मैं
1362.799,6.001,जाऊंगा मुझे वापस पहुंचना है वो बस जमीन
1366.72,4.6,परेशान हो रही थी
1368.8,5.96,[संगीत]
1371.32,6.4,तो सोफिया बहुत नाराज हो
1374.76,6.48,गई एक कप चाय पीने में कितना टाइम लग
1377.72,7.16,जाएगा आप उनसे मजरत कर लीजिएगा कल तो मैं
1381.24,3.64,आ ही रहा हूं ना तो फिर कल
1385.01,4.849,[संगीत]
1401.559,7.48,सही अभी तुम्हारा ख्याल आया और तुम नजर आ
1405.799,4.921,गई मुझे क्यों आए हो
1409.039,3.801,क्या
1410.72,5.199,चाहते
1412.84,9.16,इतने मुख्तसर सवाल का इतना मुख्तसर जवाब
1415.919,6.081,नहीं होता कहो तो मैं वहां आ करर बताऊ
1433.42,5.139,[संगीत]
1440.73,3.789,[संगीत]
1445.799,7.041,कौन था किससे बातें कर रही थी कौन गया अभी
1449.4,5.36,मुझे नहीं पता तुम्हे नहीं पता कैसे नहीं
1452.84,5.079,पता मैंने खुद देखा तुम उससे बातें कर रही
1454.76,7.2,थी साफ साफ बताओ कौन था कौन था वरना मैं
1457.919,6.12,बुलाती हूं सबको बल्कि हमजा आप भी हद करते
1461.96,5.079,हैं जली उसे ऐसे कैसे जाने दिया क्या
1464.039,6.131,सोचता होगा वो उसे वापस पहुंचना था मेरी
1467.039,24.8,वजह से पह भी नहीं अच्छा
1470.17,21.669,[संगीत]
1493.32,7.28,लगा ऐसे आंखें निकाल निकाल के क्या देख
1496.32,7.0,रही हो मेरी जगह कोई भी होता ना तो यही
1500.6,5.799,सोचता तुम्हारा पिछला रिकॉर्ड भी तो बहुत
1503.32,4.0,शानदार है ना माशाल्लाह से याद है वो
1506.399,4.201,हशमतुल्लाह
1507.32,7.76,घर तक आ गया था पीछा करते
1510.6,6.319,हुए बड़ी अकड़ दिखा रही हो
1515.08,6.319,तुम
1516.919,6.64,वैसे मर्द का हाथ बहुत भारी होता है हमजा
1521.399,4.691,को चाहिए था कि तुम्हारे मुंह पर रख के
1523.559,5.12,थप्पड़ मारता
1526.09,4.99,[संगीत]
1528.679,5.88,मां की शान में गुस्ताखी करने वाले की तो
1531.08,8.04,चमड़ी उधेड़ देनी चाहिए तुमने भी तो हद कर
1534.559,6.581,दी ना हिजामा की बछड़ी कर दी मुझ पर वो
1539.12,4.64,इल्जाम नहीं था
1541.14,6.18,[संगीत]
1543.76,8.159,आवाज तो मैंने भी सोच लिया है कि यह गेम
1547.32,8.56,अब एक नए तरीके से खेली जाएगी ऐसे है ना
1551.919,3.961,तो फिर ऐसे ही से
1558.36,8.52,जो जन्नत तुम बनाकर बैठी हुई हो ना उसे
1562.159,4.721,जहन्नम में ना बदल दिया तो मेरा भी नाम
1577.74,17.369,[संगीत]
1596.84,4.559,इन्होने दी थी मुझे दवा इन्होने दी थी
1599.159,4.88,कैसी कैसी सजाए नहीं देती थी आप मुझे इसका
1601.399,7.841,दिमाग लट जो मुह में आ रहा है बके चली जा
1604.039,5.201,रही है आप जाती में मक नहीं रही हूं
1610.95,23.729,[संगीत]
1632.6,5.52,तुम्हारी पेंसिल के छोटे छोटे टुकड़ों को
1634.679,5.921,संभाल कर रखू नी मां तुम्हारे बच्चे के
1638.12,7.16,साथ ऐसा कर सकती है
1640.6,13.46,भला बच्चा क्या मेरा कुछ नहीं लगता
1645.28,8.78,[संगीत]
1656.31,16.69,[संगीत]
1677.88,9.84,को कोई तो हो मेरा अपना कोई तो सहारा हो
1682.96,10.319,गम मेरे ठहर तो जाए कोई किनारा
1687.72,12.64,हो ठेस ऐसी दिल पे लगी क्या गुनाह हमारा
1693.279,12.081,था मांगते हैं ये खुदा से प्यार ना दोबारा
1700.36,12.24,हो प्यार ना दोबारा
1705.36,12.24,हो तकदीर जब से से तुझसे जुड़ी है जामे
1712.6,11.439,मोहब्बत जहे आशिकी है पूछो ना पूछो ना
1717.6,8.26,पूछो ना हम सताए हुए हैं सताए हुए हैं
1724.039,5.641,सताए हुए
1725.86,3.82,[संगीत]
1730.12,12.2,हैं ये इश्क तुम ना करना ये रोग ही लगाए
1736.279,12.081,दफन खुद करे फिर शोग भी मनाए ये इश्क तुम
1742.32,10.239,ना करना ये रोग ही लगाए दफन खुद करे है
1748.36,6.6,फिर सौग भी मनाए फिर सौग
1752.559,10.321,भी
1754.96,7.92,मनाए फिर आस को बुझा के ये आग भी लगाए
1772.65,7.619,[संगीत]
1784.12,3.16,[संगीत]
1792.08,7.719,हमजा हमजा जरा बात
1796.08,6.959,सुन जी दादी ये जरा हाला को डॉक्टर के पास
1799.799,6.48,ले जा पता नहीं कोई बल बल अड़ गया है वरना
1803.039,7.441,मेरे तेल में तो जादू का असर होता है नहीं
1806.279,8.361,दादी मैं ठीक हूं य य ठीक ऐसे होते हैं
1810.48,5.079,भला हमजा लेकर जा इसे दादी मुझे इसके साथ
1814.64,4.68,नहीं
1815.559,10.201,जाना क्यों तुम दोनों लड़े हुए हो क्या
1819.32,9.959,आपस में वाकई नहीं दादी ऐसे ही नहीं
1825.76,7.759,दादी लड़ने के लिए बराबरी
1829.279,6.681,शर्त यहां तो एक फरीक बहुत ताकतवर
1833.519,6.921,हो हावी हो
1835.96,6.68,गरे कौन फरीक कौन ताकतवर कौन सी जंग छिड़
1840.44,6.44,गई यहां पर मुझे तो कुछ समझ में नहीं आ
1842.64,6.639,रहा भाई नहीं दादी ऐसे ही कर है अच्छा बस
1846.88,4.639,छोड़ ना इन सारी बातों को या जाके डॉक्टर
1849.279,6.36,प दिखाना
1851.519,6.76,इसे शुक्र है फो आपकी हकीमी तो खत्म हुई
1855.639,5.4,तुम मुझे ले जाना डॉक्टर के पास आखिर
1858.279,6.601,बच्ची कब तक इतना दर्द सहेगी
1861.039,7.561,हां वैसे ठीक कहते हैं स्याने असल से
1864.88,7.639,ज्यादा सूद प्यारा होता है अब मुझे पता
1868.6,9.0,चला आपको हमजा इतना प्यारा क्यों
1872.519,8.16,है हा हा ठीक है लो मैं जरा वजू करू हूं
1877.6,3.079,नज का वक्त निकल
1883.44,5.239,जाएगा
1885.84,6.4,ला माफी मांगो मुझसे
1888.679,6.48,आई से से सॉरी नहीं नहीं रहने दो रहने दो
1892.24,5.679,हमजा अब हम जबरदस्ती किसी के दिल में
1895.159,4.64,एहतराम तो नहीं पैदा कर सकते ना ला तुमने
1897.919,3.681,सुना नहीं मैं क्या कह रहा हूं माफी मांगू
1899.799,4.72,नहीं मांगूंगी
1901.6,5.64,माफी नहीं कर सकते जबरदस्ती मेरे
1904.519,6.16,साथ पहली बार आवाज ऊंची करके मेरी जुबान
1907.24,5.6,बंद करवा दी थी दूसरी बार करोगे तो
1910.679,5.96,तुम्हारी पसंद के जुमले भी बोलने लग
1912.84,6.4,जाऊंगी लेकिन अपनी बात प कायन रहूंगी
1916.639,6.241,इन्होंने ही दी थी मुझे
1919.24,5.72,दवाया तुमसे मुझे यह उम्मीद नहीं थी पहले
1922.88,4.32,तुम दवाइयां खाती रही हो कि मेरा बच्चा
1924.96,5.64,गिर जाए और आप इल्जाम लगा रही हो मेरी मां
1927.2,3.4,पे शर्म आ चाहिए
1931.48,5.319,तुम्हे आप लोग प्लीज थोड़ा आहिस्ता
1934.48,5.28,बोलेंगे आप लोग की तो लड़ाइया ही नहीं
1936.799,5.441,खत्म होती बाहर सारी आवाज जा रही है खुरम
1939.76,5.48,क्या सोचेगा मेरा उससे रिश्ता होने जा रहा
1942.24,3.0,है
1954.76,6.799,दादी आप अगर बाहर आ जाए तो उसकी सलाम दुआ
1957.679,8.0,हो जाती आपके साथ अच्छा हो जाएगा प्लीज
1961.559,7.371,हां आती हूं जरा नमाज पढ़ लू फिर आ जी
1965.679,7.41,थैंक यू
1968.93,4.159,[संगीत]
1985.4,4.959,[संगीत]
1990.44,5.239,अब हम जबरदस्ती किसी के दिल में एतराम तो
1993.159,5.4,नहीं पैदा कर सकते ना ला तुमने सुना नहीं
1995.679,2.88,मैं क्या कह रहा माफी
2000.36,5.919,मांग तुमसे मुझे ये उम्मीद नहीं थी पहले
2004.0,5.399,तुम दवाइया खाती रही हो कि मेरा बच्चा गिर
2006.279,5.36,जाए और अब इजाम लगा मेरी मां पे शर्म आनी
2009.399,2.24,चाहिए
2020.279,4.24,तुम्हे मुझे नीचे जाने दे मेरा दिल डूब
2023.0,5.0,रहा है मैं नहीं बै डूबने वाली कोई बात
2024.519,6.4,नहीं आप लेटे नीचे जाना है मुझे हमजा लेटे
2028.0,6.12,ना आपको दादी बुला रही है
2030.919,4.961,नीचे और मेरा अंदाजा ठीक था ना वही मिठाई
2034.12,5.439,वाला लड़का
2035.88,6.32,है अब तो जाने नीचे वो बुला रही है वो
2039.559,2.641,बहुत नाराज हो
2045.48,13.09,जाएंगी भाई आपको भी बुलाया है तुम चलो
2052.94,5.63,[संगीत]
2064.25,3.179,[संगीत]
2075.8,9.44,ओ इनसे मिलो यह है जमीन की ताई जान बड़ी
2080.48,4.76,लाडली है जमीन इनकी जान छड़ती है जमीन
2087.5,8.02,[संगीत]
2091.24,4.28,पर सलाम वालेक
2096.04,7.059,[संगीत]
2105.16,5.56,क्या हो गया शाहजन आप आपके जवाब का मुंतज
2108.2,5.1,है यह इसे सलामती तो दे दे ताकि यह बैठ
2110.72,20.44,जाए
2113.3,22.02,[संगीत]
2131.16,7.28,वाह रम मिया वाह इतने बड़े शहर में
2135.32,6.32,तुम्हें और कोई घर नहीं मिला जो दूसरी
2138.44,5.36,लड़की के तलबगार बनकर भी हमारे ही घर आ गए
2141.64,5.36,शाहजन आप क्या
2143.8,7.72,शाजान आंखें बड़ी हो जाने से ना नजर तेज
2147.0,8.77,नहीं हो जाती यह यह है व राजकुमार जिसे
2151.52,11.409,तुम हमजा की टक्कर पर लेकर आए
2155.77,7.159,[संगीत]
2163.319,7.081,लगता है किसी को मेरी बात का यकीन नहीं
2165.16,7.64,आया तो ठीक है मैं फिर पहले वाली लड़की
2170.4,2.4,पेश कर
2174.0,6.079,दे आ जाओ
2177.0,6.96,हाला कब तक दरवाजे के पीछे छुपकर अपने
2180.079,6.311,आशिक का दीदार करोगी शाह जहान खुदा का खौफ
2183.96,6.96,कर
2186.39,6.53,[संगीत]
2190.92,4.82,गेम
2192.92,6.2,ओवर छोड़ नहीं जाना मुझे ई
2195.74,3.38,[संगीत]
2199.359,7.521,जान अम्मी क्या कर ला का हा छोड़े मैं
2204.16,3.84,किसी इजाम को नहीं मानता हाला ऐसा कुछ
2206.88,4.28,नहीं कर
2208.0,7.319,सकती मुझे हाला पर पूरा भरोसा है व किसी
2211.16,7.12,को चीट नहीं कर सकती इजाम व इजाम नहीं था
2215.319,6.28,बेटा तुमने मुझसे इसकी ब दौड़ी का सबूत
2218.28,4.2,मांगा था ना उस वक्त नहीं था मेरे पास
2221.599,3.72,लेकिन
2222.48,7.72,देखो क्या इंसाफ है मेरे मालिक का कि वो
2225.319,4.881,सबूत चलकर खुद मेरे घर आ
2231.76,6.96,गया आप मेरी बीवी को किसी के भी सामने पेश
2234.64,8.12,कर देंगी अम्मी पर ये है कौन हु आर यू एक
2238.72,7.599,मिनट खबरदार परे हो जाओ तुम और तुम जवाब
2242.76,6.16,दो हाला कौन है ये शख्स तुम जानती हो इसे
2246.319,4.601,हाला इस शख्स को नहीं जानती
2248.92,4.72,इस बात को अ इधर ही खत्म कर दे ला कमरे
2250.92,5.679,में चलो कमरे में नहीं जाओगी तुम मुझे
2253.64,4.01,मेरी बात का जवाब चाहिए तुम जानती हो इस
2256.599,5.041,शख्स
2257.65,8.59,[संगीत]
2261.64,7.52,को बोलो ना हाला तो कभी झूठ नहीं बोलती
2266.24,7.2,हमेशा सच बताती है तो बोलो
2269.16,8.8,अब हाला मेरी बर्दाश्त को मजीद मत
2273.44,7.72,आजमाओ मुझे मेरी बात का जवाब चाहिए
2277.96,6.879,आंटी ये सब क्या तमाशा लगाकर रखा हुआ है
2281.16,6.48,कौन है ये लड़की मैं मैं इसे नहीं
2284.839,5.361,जानता अंकल मैं तो मैं तो खुद पहली बार
2287.64,5.12,देख रहा हूं उस लड़की
2290.2,6.6,को मुझे अंदाजा नहीं था कि मुझे इस तरह
2292.76,6.2,बुलवाकर जलील किया जाएगा और क्यों झूठ बोल
2296.8,4.279,रहा है य शस झूठ बोल रहा है बकवास कर रहा
2298.96,6.08,है ये दोनों आपस में मिले हुए हैं और आप
2301.079,7.28,सच बोल रही है क्या सबूत है आपके पास इनके
2305.04,5.6,साथ कोई दिमागी दिमागी मसला है क्या स्किच
2308.359,5.561,फ्रेनिया लाइक के अपनी तरफ से कहानियां
2310.64,6.08,क्रिएट कर रहे है हमजा हमजा रईस ये ये वही
2313.92,5.72,लड़का है य ये हाला को जानता है ये आया था
2316.72,5.28,यहां इधर ही इसी सोफे प बैठा था इसी सोफे
2319.64,4.479,प इसने इसने ला का रिश्ता मांगा था मुझसे
2322.0,5.839,रस मैं सच कह रही
2324.119,5.681,हूं मैं अब एक मिनट यहां नहीं ठहर सकता
2327.839,4.961,एंड मिस्टर को अपनी वाइफ की इज्जत का
2329.8,5.36,ख्याल है तो क्या मेरी इज्जत नहीं है खुदा
2332.8,5.12,हाफिज नहीं नहीं बेटा प्लीज प्लीज रुक जाओ
2335.16,4.28,कहीं ना जाओ मैं तुमसे मजरत करती हूं
2337.92,3.04,तुम्हे यहां रहने की कोई जरूरत नहीं हम
2339.44,3.76,यहां से चले जाते हैं बस तुम कहीं नहीं
2340.96,5.92,जाओगे आ जाओ आंटी प्लीज आप मुझे क्यों
2343.2,6.59,गुनहगार कर रही है आप तो तो मेरी मां की
2346.88,7.39,जगह है प्लीज हा बस ठीक है चलो
2349.79,4.48,[संगीत]
2354.599,6.441,चलो रस रईस हमजा मैं सच कह रही हूं यही
2357.96,3.08,लड़का था यही था व
2362.64,6.439,लड़का शाह
2364.599,8.281,जहान तूने तो मानने में बिच्छू को भी पीछे
2369.079,7.0,छोड़ दिया ऐसा कीना तो हाथी और ऊंट भी
2372.88,6.76,नहीं पालते और ऐसी नफरत तो कोई पागल
2376.079,7.481,कुत्ते से नहीं करता जितनी तूने इस बेचारी
2379.64,6.08,हाला से की है शाह जहान
2383.56,6.36,आ तौबा
2385.72,4.2,तौबा तौबा तौबा
2392.24,10.44,तबा ये इश्क तुम ना करना ये रोग ही लगा
2399.0,6.24,ुद करे है फिर भी
2402.68,4.32,मनाए समन तुम्ह याद है हाला ने तुम्ह
2405.24,5.079,बताया था कि वो अपने किसी दोस्त के भाई को
2407.0,5.599,पसंद करती है ये ये रम वही लड़का है वही
2410.319,4.601,रम की ना कोई बहन है ना कोई भाई अकेला है
2412.599,3.801,वो इस दुनिया में मुझे तुम पर पूरा भरोसा
2414.92,2.96,है लेकिन इन लोगों की तसल्ली के लिए एक
2416.4,2.4,बार प्लीज बोल दो कि तुम उस शख्स को नहीं
2417.88,6.12,जानती
2418.8,7.559,हो मुझे माफ कर मुझे माफ कर वक्त साबित
2424.0,4.68,करेगा कि मैं सच बोल रही हूं एक इंसान
2426.359,5.0,अपने जैसे इंसान की नफरत में इतना आगे
2428.68,4.36,कैसे बढ़ सकता आपका यह वाला हरबा नहीं चला
2431.359,4.321,अब आपको कुछ नया सोचना पड़ेगा इस पर किसी
2433.04,4.4,ने यकीन नहीं किया इस तरह आपकी मदर ने
2435.68,4.04,मुझे हिट क्यों किया क्या दुश्मनी थी उनकी
2437.44,4.96,मुझसे या दुश्मनी आपसे नहीं दुश्मनी मुझसे
2439.72,5.44,है अल्लाह जिसका पर्दा रख ले फिर दुनिया
2442.4,6.16,की कोई ताकत उस पर्दे को चाक नहीं कर सकती
2445.16,3.4,ताई जान
