Start Time (s),Duration (s),Text
1364.44,3.599,है सुन लेती
1368.279,5.921,हूं लेकिन बचा क्या सुनने को
1374.42,13.009,[संगीत]
1390.76,5.96,एक बार कहा है तुम्हें समझ नहीं
1393.12,6.0,आता तुम इस घर में नहीं आ सकते इसे मैंने
1396.72,2.4,बुलाया
1400.48,3.319,हमजा पीछे
1404.559,5.561,हटो तुम कहां जा रहे हो
1406.96,5.719,हमजा तुम्हारे घर की लड़की एक गैर मर्द के
1410.12,4.439,आगे खड़ी है या फिर तुम्हारी छोरी सिर्फ
1412.679,4.841,अपनी बीवी की इज्जत के लिए उठती
1414.559,5.561,है यह ना समझना कि मैं तुम्हें इससे लड़ाई
1417.52,5.44,करने प उसा रही हूं समीन प्लीज मुझे बोलने
1420.12,5.559,का मौका दो मैं हर चीज की वजाहत पहली बार
1422.96,6.12,नहीं हुआ है मेरे साथ ये सब कुछ एक दफा
1425.679,6.201,पहले भी हाला मेरी खुशियों प मेरे ख्वाबों
1429.08,2.8,पर पैर रख चुकी
1431.96,6.8,है लेकिन इस बार तो उसने उसने मेरी इज्जत
1435.6,6.72,नफ्स की दर्जिया उड़ा दी मैं तो बस ये
1438.76,6.08,सोचू कि ये सब कुछ ये सब कुछ मेरे साथ ही
1442.32,6.92,क्यों होता है मैंने तो कभी किसी का बुरा
1444.84,8.6,नहीं चाहा तुम बताओ हमजा खता क्या है मेरी
1449.24,7.52,समीन समीन प्लीज मैं मैं तुम्हें सफाई
1453.44,6.359,देने के लिए आया हूं मेरे साथ ऐसा मत कर
1456.76,5.76,तुम कौन सा खेल खेलने आए हो मेरे साथ अगर
1459.799,6.441,ताई जान ना बताती तो हाला ने तो जिंदगी भर
1462.52,5.6,अपना मुंह नहीं खोलना था और मैं मैं सारी
1466.24,4.12,जिंदगी एक धोखे में रहती रहती तुम्हारे
1468.12,2.24,साथ
1470.76,7.039,वैसे बाय द वे तुम्हारा और हाला का प्लान
1473.44,7.64,क्या था बताओ अब पूछा जा रहा है तो बताओ
1477.799,4.531,ना नहीं नहीं मेरी बात सुनो हाला का इस सब
1481.08,2.8,से कोई ताल्लुक नहीं
1482.33,6.469,[हंसी]
1483.88,7.76,था वाह देखो हमजा यह अभी भी अपनी साबका
1488.799,6.841,महबूबा को डिफेंड कर रहा
1491.64,7.12,है ओ सॉरी सॉरी साबका कह दिया गलत कह दिया
1495.64,5.919,ना क्योंकि साबका तो व कभी हो ही नहीं सही
1498.76,5.36,कह रही हूं ना मैं तुम बार-बार हाला को
1501.559,5.72,बीच में क्यों लाती हो उस तुम्हें गैरत आई
1504.12,7.4,होगी लेकिन हाला का जिक्र किए बगैर यह
1507.279,7.961,किस्सा अधूरा है हमजा भूल ग हो
1511.52,5.92,तुम इन दोनों की कितनी अच्छी बंडिंग है जब
1515.24,5.84,हाला से पूछा गया कि वह खुरम को कैसे
1517.44,6.719,जानती है तो तो इसने इसने हाला को जवाब
1521.08,6.16,देने की जहमत ही नहीं की खुद ही आगे आ गया
1524.159,6.321,और बोला कि जानता ही नहीं पहले कभी मिले
1527.24,6.24,ही नहीं य बंडिंग है इन दोनों की समीन ऐसा
1530.48,6.24,कुछ भी नहीं है कुछ भी नहीं है ऐसा तो फिर
1533.48,6.72,कैसा है खुरम तुम किस प्लानिंग के तहत
1536.72,6.72,मेरी जिंदगी में आए थे बताओ एक सेकंड समीन
1540.2,6.92,यहां पर तुम गलत हो मैंने कोई मंसूबा नहीं
1543.44,5.44,बनाया था मैंने मैंने सिर्फ एक लड़की को
1547.12,4.24,गुंडों से बचाया था और वो गुंडे मेरे भेजे
1548.88,5.56,हुए नहीं थे
1551.36,7.88,शायद शायद उस शस का तुमसे ही तुमसे कोई
1554.44,7.8,जाती ताल्लुक था मेरा नहीं मेरा नहीं
1559.24,5.36,वो भी तुम्हारी तरह इनकी बीवी का पुराना
1562.24,6.439,आशिक था समीन तुम बारबार क्यों ला रही हो
1564.6,7.959,हाला को बीच में हाला बीच में है तभी तो
1568.679,6.281,यह अदालत लगी है और मैं मैं य मुजरिम
1572.559,7.921,दुहाईयां दे रहा
1574.96,8.8,हूं और हमजा रहे तुम तो तुम्हारा किरदार
1580.48,5.079,सिर्फ ऑडियंस का है और कुछ नहीं बस यहां
1583.76,4.919,मेरी बीवी की बात हो रही है
1585.559,6.6,सु मैं सिर्फ तमाशबीन बनक खड़ा नहीं हो
1588.679,7.281,सकता हां हां तुम्हें तो चाहिए एक फिल्मी
1592.159,6.481,बड़क मार कर इन दोनों को शूट कर दो रंगे
1595.96,5.8,हाथों जो पकड़ा था इन्हे है ना ऐसा कुछ
1598.64,4.84,नहीं है समीन ये सब कुछ तुम्हारी ताई जान
1601.76,5.72,की कारस्तानी
1603.48,7.48,थी वो वो एक तीर से दो शिकार करना चाहती
1607.48,6.52,थी कि हाला हमजा की जिंदगी से निकल जाए और
1610.96,6.04,तुम मेरी जिंदगी से निकलता स मैं जानता
1614.0,5.64,हूं कि मुझसे बहुत ज्यादा गलतियां हुई है
1617.0,6.279,पर मेरा अल्लाह जानता है
1619.64,7.159,मैं मैं हमेशा से तुमसे मुखलिस था और हूं
1623.279,7.801,ऐसे बेशर्म आदमी हो तुम अभी कल तुम्ह
1626.799,7.161,धक्के देक घर से निकाला है फिर आ गए अंकल
1631.08,5.09,अंकल प्लीज मेरी बात सुन प्लीज एक बार
1633.96,5.869,मेरी बात सुन
1636.17,3.659,[संगीत]
1640.679,5.681,ले इस निकालिए य
1643.88,6.64,सेरा
1646.36,7.28,दिल दिल क्यों पकड़ अब अपना पहले पर्दे
1650.52,6.36,नहीं डालने थे ना बेटी तुम्हारी मशका चला
1653.64,6.48,रही थी और तुम कह रहे थे कि जी मेरे दोस्त
1656.88,4.639,का बेटा है मेरे जानने वाले हैं अब भुख तो
1660.12,4.2,प्लीज बस कर दे
1661.519,4.04,भ अब घर की बेटियों के मसले इस तरह घर के
1664.32,6.0,दरवाजों प हल
1665.559,7.761,होंगे तुम्हें मेरी बेटी ही मिली थी ऐसा
1670.32,6.079,फ्रॉड ऐसा धोखा क्यों किया तुमने मेरी
1673.32,5.4,बेटी के साथ क्यों किया मैंने तो तुम्हें
1676.399,6.12,बेटा समझा था और तुमने
1678.72,6.959,आहिस्ता बात करो सोफिया आवाज घर से बाहर
1682.519,6.04,नहीं जानी चाहिए तुम जैसे मां-बाप के साथ
1685.679,7.0,ऐसे ही होता है जो बेटियों के पीछे
1688.559,7.441,लगते आप मेरी करदार कशी कर ताया जान बस
1692.679,7.201,कीजिए मेरे सामने उंगली उठाती हो
1696.0,6.48,तुम मेरी बेटी अगर ऐसी हरकत करती ना तो
1699.88,6.039,तुम देखती
1702.48,6.56,पली समीन के किरदार से सब अच्छी तरह वाकफ
1705.919,7.201,है प्लीज बस से आगे कुछ ना
1709.04,7.639,[संगीत]
1713.12,3.559,चाहिए जाओ यहां
1717.38,7.79,[संगीत]
1720.799,7.43,से अरे जाओ भाई क्यों खड़े
1725.17,3.059,[संगीत]
1729.44,3.719,हो चले हम
1733.21,5.1,[संगीत]
1735.48,4.199,हाय अम्मी
1738.31,6.209,[संगीत]
1739.679,4.84,अब पहली महसूस हो रहा
1744.799,5.88,है चले निकले निकले य
1750.76,6.08,[संगीत]
1754.039,6.48,से लड़कियों के मां-बाप सो भी रहे हो ना
1756.84,7.839,तो एक आंख खुली रख के सोते हैं हमारी तरफ
1760.519,7.88,देखो हमारी भी तो बेटी है 8 बजे कॉलेज
1764.679,5.521,जाती है पूरे दो बजे घर वापस आ जाती है
1768.399,5.041,उसके बाद क्या करती है
1770.2,6.92,व सारा वक्त या मोबाइल पर गेम्स खेलती
1773.44,5.0,रहती है या लतीफे सुनक हसती रहती है यहां
1777.12,4.919,देख लो क्या हाल
1778.44,6.68,है बेटी जा रही है बेटी आ रही है कहां जा
1782.039,4.52,रही है कहां से आ रही है बजल है किसी को
1785.12,4.48,खबर
1786.559,6.161,हो तो उन बापों के बारे में भी तो इरशाद
1789.6,5.04,कीजिए ना जो सात समंदर पार जाकर बैठ जाते
1792.72,5.52,हैं और पलटक खबर ही नहीं
1794.64,6.56,लेते तुम क्यों बोल रही हो दरमियान में
1798.24,6.439,देख रही हो ना मैं बात कर रहा हूं दरमियान
1801.2,5.56,में नहीं बोल रही आखिर में बात कर रही हूं
1804.679,7.961,हासिल कलाम कहते हैं
1806.76,5.88,इस इसकी लड़की मेरे घर में नहीं रह सकती
1818.03,3.93,[संगीत]
1825.14,3.109,[संगीत]
1833.399,5.731,आपने देखा शाहजहां भाभी ने किस तरह
1836.24,4.679,किया कितनी हिकारत थी उनके लहजे
1839.13,4.47,[संगीत]
1840.919,6.201,में देखो नफीस
1843.6,8.76,मैं इस बात से इंकार नहीं कर
1847.12,8.519,सकता मेरी तो हाला भतीजी है मेरा खून
1852.36,7.919,है लेकिन शाहजहां ने उसे
1855.639,4.64,हमेशा अपने ऊपर मुसल्लत जदा
1860.919,6.441,समझा उस पर यह हुआ कि मैंने हमजा से उसकी
1864.24,7.64,शादी करवा दी तो ब और भड़क
1867.36,9.199,गई अब जो कुछ हुआ शाहजहा नहीं रहने देगी
1871.88,8.0,उसे इस घर में तो फिर मैं क्या करूं रईस
1876.559,5.761,भाई क्या कर सकते हो तुम तो आप ही बताए
1879.88,5.399,रईस भाई मुझे क्या करना
1882.32,6.599,चाहिए देखो मुझे हमेशा हाला से बहुत
1885.279,5.441,हमदर्दी रही है
1888.919,5.72,बहुत तड़पी है वो तुम्हारे
1890.72,3.919,लिए बहुत मिस किया है
1894.88,4.799,उसने हालाकि अम्मा ने बहुत मोहब्बत की
1897.96,5.0,मोहब्बत की हद कर
1899.679,4.641,दी उसके बावजूद नफीस मां बाप की जगह तो
1902.96,6.36,कोई नहीं ले
1904.32,8.959,सकता खास तौर पर बाप की अब रूमी को
1909.32,7.68,देखो अपनी मां से ज्यादा मुझसे अटैच
1913.279,7.321,है उसकी छोटी से छोटी प्रॉब्लम सिर्फ मुझे
1917.0,6.039,पता होती है बस करें रईस भाई बस करें मेरे
1920.6,5.679,पास आखिर और कोई चारा भी तो नहीं था क्या
1923.039,5.841,करता मैं हाला को अपने साथ ले जाता आप
1926.279,7.041,जानते हैं यह पॉसिबल नहीं था वहां पर भी
1928.88,9.399,मेरी फैमिली थी बच्चे थे खुद के मसाइल
1933.32,8.0,थे चलो ठीक है ठीक है अम्मा का इंतकाल हो
1938.279,5.841,गया उनका स्वयं भी हो गया तुम जाओ वापस
1941.32,6.12,अपनी फैमिली में अपने मसाइल देखो यहां के
1944.12,5.039,मसाइल हम खुद देख लेंगे यही हो सकता है ना
1947.44,4.56,मेरा य मतलब नहीं
1949.159,5.721,था तुम्हारे इसी रवैए की वजह से अम्मा
1952.0,6.279,हमेशा परेशान रही जानते हो
1954.88,6.159,तुम हाला को
1958.279,3.76,लेकर उसी की फिक्र करती हुई मौत के मुंह
1961.039,5.88,में चली
1962.039,7.48,गई और तुम क्या समझते हो वह क्यों इतना हक
1966.919,6.321,हक हक की बात करती थी हाला के
1969.519,5.241,लिए अम्मा कहती थी कि औरत को फाइनेंशली
1973.24,4.24,मजबूत होना
1974.76,4.36,चाहिए ताकि इस तरह के हालात में वो खुद को
1977.48,6.039,संभा
1979.12,8.32,स बस यही सोचते सोचते अम्मा चली गई अब
1983.519,5.4,अम्मा तो है नहीं और शाहजहां हाला को यहां
1987.44,6.8,नहीं रहने
1988.919,5.321,देगी हाला को घर में हिस्सेदार बनाना
1995.519,8.481,चाहती नफीस इसका एक हल है मेरे पास तो
1999.399,21.2,बताए रईस भाई कैसा हल
2004.0,16.599,[संगीत]
2021.559,5.12,तो उन बापों के बारे में भी तो इरशाद
2023.519,6.481,कीजिए ना जो सात समंदर पार जाकर बैठ जाते
2026.679,3.321,हैं और पलट कर खबर ही नहीं
2030.799,4.88,लेते वो क्यों इतना हक हक हक की बात करती
2034.32,5.56,थी हाला के
2035.679,5.24,लिए अम्मा कहती औरत को फाइनेंशली मजबूत
2039.88,3.84,होना
2040.919,5.201,चाहिए ताकि इस तरह के हालात में वह खुद को
2043.72,2.4,संभाल
2047.48,7.199,सके अब जो कुछ हुआ शाह जहान नहीं रहने
2051.72,2.959,देगी उसे इसर
2055.21,11.469,[संगीत]
2062.0,4.679,में कहां जा रहे हो हम
2068.28,2.319,और क्या
2071.639,8.881,करू कर ऐसा कब तक
2076.76,5.61,चलेगा अब सारी जिंदगी ऐसे चलेगा
2080.52,6.119,ला
2082.37,8.67,[संगीत]
2086.639,9.48,हम री एक पल की बेतना बर्दाश्त नहीं हो
2091.04,5.079,रही जिंदगी की बात नहीं कर
2101.04,3.36,[संगीत]
2102.599,4.801,तुमने खुद कहा
2104.4,5.56,था कि मेरे साथ इस कमरे में रहना तुम्हारे
2107.4,2.56,लिए सजा
2111.0,4.68,है तो फिर अपनी अपनी ही बात से क्यों फिर
2114.16,4.36,रहे
2115.68,5.36,हो फिर काटो यह
2118.52,6.44,सजा
2121.04,10.0,भुगतो भाग क्यों रहे हो ये इश्क तुम ना
2124.96,11.8,करना ये रोग ही लगा ए सफन खुद करे है फिर
2131.04,12.2,सौग भी मनाए ये इश्क तुम ना करना ये रोग
2136.76,8.12,ही लगाए दफन खुद करे हैं फिर शौग भी मनाए
2143.24,4.48,फिर शौग
2144.88,8.64,भी
2147.72,10.52,मनाए आशिकों के दिल में ये आस भी लगाए फिर
2153.52,10.68,आस को बुझा के ये आग भी लगा
2158.24,5.96,फिर लास को बुझा के ये आग भी
2176.64,7.24,लगाए कपड़े
2180.0,3.88,निकाले कब्रस्तान जा रहा
2184.24,7.64,हूं दादी के पास
2186.83,7.61,[संगीत]
2191.88,2.56,मुझे भी ले
2196.0,3.0,जाओ
2200.24,3.0,प्लीज
2203.32,12.34,[संगीत]
2215.72,3.8,चलो आमी
2220.54,5.86,[संगीत]
2222.72,3.68,दी मुझे क्यों छोड़ के चली
2227.599,4.921,गई अपनी हाला का एक दफ भी नहीं
2232.92,4.36,सोचा कि क्या होगा मेरा आपके
2238.57,6.19,[संगीत]
2240.8,6.92,बगैर य हाला के आंसू पचने वाला कोई नहीं
2244.76,7.68,है
2247.72,4.72,और ना ही हाला की बात यकीन करने वाला कोई
2252.92,3.88,है रुल गई आपकी
2257.44,4.0,हाला सब पर बाद
2263.52,9.04,हो एक छोटी सी गलती को गुना कबीरा बनाकर
2267.76,4.8,मेरा सारा नाम माल स्या कर दिया
2273.839,5.601,गया आपको अभी नहीं जाना चाहिए था दादी
2279.92,4.84,ऐसी जरूरत मुझे आपकी कभी नहीं पड़ी जितनी
2282.48,2.28,अब
2287.28,3.92,है आप कहती थी
2289.97,6.47,[संगीत]
2291.2,5.24,ना एक बार नफीस आ जा तो सब कुछ ठीक हो
2296.76,6.64,[संगीत]
2299.16,9.0,जाएगा आपका बेटा भी कुछ नहीं कर पाया
2303.4,4.76,दादी कुछ नहीं कर पाया
2309.61,7.019,[संगीत]
2318.65,33.11,[संगीत]
2344.72,12.28,तकदीर जब से तुझसे जुड़ी है जामे मोहब्बत
2351.76,7.16,जहे आशकी है कमन हमसा हला इ इनोसेंट तुम
2357.0,3.52,इतने साल ऑस्ट्रेलिया में रह के आए हो और
2358.92,3.679,तुम इतनी छोटी सी बात प इस तरह रिएक्ट
2360.52,4.48,करोगे छोटी सी बात नहीं है गुस्सा मुझे
2362.599,4.881,उसके झूठ पर है इतना प्यार करने वाले की
2365.0,5.88,बेरुखी बर्दाश्त नहीं होती तुमसे वाबस्ता
2367.48,6.04,हर चीज से नफरत है मुझे हमजा से भी हला को
2370.88,5.4,इस घर से कोई नहीं निकाल पाएगा और हमजा ने
2373.52,4.92,उसे अपने दिल से ही निकाल दिया तो नफीस ने
2376.28,4.6,अपना हिस्सा हाला के नाम कर दिया है नोटों
2378.44,5.56,से अगर बेटियों के नसीब बनते होते ना तो
2380.88,5.84,सिर्फ बादशाहों की बेटियां बस इस घर की
2384.0,6.319,मलकीत का मुझे क्या फायदा जब मैं दिलों से
2386.72,6.16,ही बेदखल हो चुकी हूं रेम से रुको हमारे
2390.319,5.921,घर के ऊपर जो नहुसत का साया था ना वो हट
2392.88,6.88,गया वो चली गई है हमजा की जिंदगी से मेरी
2396.24,3.52,जिंदगी से ले गया a
