Start Time (s),Duration (s),Text
0.12,8.439,दिल ये मेरा तेरे दिल से जा मिला है रब से
5.64,7.4,जिसको मांगा
8.559,7.8,तू र्रम याद है ना हमजा ने ना मेरी बात का
13.04,4.96,यकीन नहीं किया सबूत इकट्ठा करने में जरा
16.359,4.76,टाइम लगता
18.0,6.56,है मैं तो कोशिश कर रही हूं गवाही पेश कर
21.119,5.881,दूं ला मेरी मां है वो बहुत प्यार करता
24.56,4.68,हूं बहुत इज्जत करता हूं उनकी आई नो बहुत
27.0,5.64,जगह प गलत होती है लेकिन मैं उन्हें
29.24,7.28,क्वेश्चन नहीं कर स सता यार मां है मेरी व
32.64,7.8,हमेशा सोचती थी वो कैसी सासे होंगी जो
36.52,7.12,बहुओं को जिंदा जला देती है बड़े जिगरे का
40.44,6.56,काम है वही लेकिन अब सोचती हूं मेरे जैसी
43.64,9.84,मजबूर होती होंगी है
47.0,13.28,ना दि ये मेरा तेरे दिल से जा मिला है रब
53.48,6.8,से जिसको मांगा तू वो सला है
62.8,5.72,बस बेचा
65.52,3.0,बस
71.119,6.721,लो मुझे छोड़ कर चली गई मैं
74.24,6.4,तो तो अकेला रह गया इस दुनिया में अरे ऐसे
77.84,6.239,कैसे अकेले रह गए हो मैं हूं ना तुम्हारे
80.64,7.439,साथ मा सके जा दोबारा कभी ऐसी बात अपनी
84.079,4.0,जुबान प ना लाना बेटा
90.88,7.32,आप है
92.079,10.441,ना सॉरी रामा बिल्कुल भी काम नहीं कर रहा
98.2,9.16,शफक शफक बेटा बेटा खाना लगा दो खुरम के
102.52,10.95,लिए जी अम्मी लग गया आ जा बेटा थोड़ा सा
107.36,18.239,खाना खा फिर आराम कर लेना आ आओ मेरा बेटा
113.47,12.129,[संगीत]
129.319,8.121,खा मेरा बे खाना खा लो आराम से शक तुम
133.319,7.601,इसका बिस्तर लगा दो थोड़ा सा आराम कर ले
137.44,6.12,पहले मां की बीमारी फिर फिर उनके चले जाने
140.92,5.64,के सद मेंे ने इसको तोड़ दिया है जाओ मेरा
143.56,3.0,ब
147.3,6.659,[संगीत]
150.92,6.039,फंक्शन क्या मिल बैठने का बहाना है बस कोई
153.959,6.401,जरूरत नहीं है अम्मा आगे आपकी खुशी की
156.959,6.041,खातिर मैंने लाखों रुपए खर्च किए वलीम प
160.36,6.64,बस रस्म तो होगी रईस मैंने कह दिया है ना
163.0,6.239,क्या है अ ये सकुम वालेकुम अस्सलाम
167.0,6.12,वालेकुम अस्सलाम मैं जा रहा हूं अम्मा
169.239,7.401,खुदा हाफिज खुदा हाफिज खुदा हाफिज दादी
173.12,7.039,आपने बुलाया था हां बस यह कहना था कि आज
176.64,4.92,शाम को जरा जल्दी आ जाना हाला का खीर में
180.159,5.521,हाथ डलवाना है
181.56,7.92,आज हाथ खीर में आनाज निक नहीं हो जाएगा
185.68,7.32,दादी चम्मच वुड बी अ बेटर आइडिया य अल्लाह
189.48,7.56,क्या हो गया तुझे पागल ना हो तो अरे बेटा
193.0,6.4,महावरा है ये जब नई दुल्हन घर आती है ना
197.04,7.68,तो पहली दफा जब वो मीठा पकाती है उसको
199.4,7.88,कहते हैं ये ओ हां तो इस पूरी रसम में
204.72,6.239,एटली मैंने क्या करना है खीर में दुल्हन
207.28,6.64,के लिए तोहफा लाना है उसको तोहफा देना है
210.959,5.041,ये अच्छी बात है फिर मैं जाऊं मेहनत
213.92,6.44,मजदूरी करूं कुछ पैसे कमाऊ ताकि तोहफे के
216.0,6.12,लिए पैसे कट हो वैसे चाहिए क्या आपको तोफ
220.36,5.76,नहीं
222.12,8.28,नहीं चले मैं जा रहा खुदा
226.12,6.92,हाफिज हा है बेवकूफ ना हो बताया क्यों
230.4,2.64,नहीं उसको
234.72,9.079,ी क्या जरूरत है रसन वगर जरूरत क्यों नहीं
239.12,7.199,अरे पगली मर्द के दिल का रास्ता मेदे से
243.799,6.121,जाता है तो दादी मैं क्या करूंगी इस
246.319,5.881,रास्ते से गुजर के क्या करना है राज करना
249.92,5.159,राज दिल
252.2,5.96,पर मैं उसके काबिल नहीं हूं
255.079,4.44,दादी उसके काबिल नहीं हूं मैं ये क्या
258.16,7.28,काबल
259.519,9.96,है क्या हुआ है हमजा ने कुछ कहा है ना वो
265.44,7.52,तो नहीं कह सकता अरे वो कैसे कहेगा काबिल
269.479,7.041,थ तभी तो निकाह करके लाया ना नहीं दादी
272.96,7.88,मैं आपको नहीं समझा सकती बस अच्छा चल मैं
276.52,4.32,नहीं समझूंगी तो तू जरा खुल के मुझे बता
283.32,8.92,दे कल हम हमजा के दोस्तों से मिलने
287.8,6.64,गए वो सब इतने पढ़े लिखे हैं सब काबिल है
292.24,7.92,और सब हमजा जैसे
294.44,7.7,हैं मैं तो उनमें कहीं फिट नहीं आ रही थी
300.16,5.44,मुझे तो उनके जैसी बातें भी नहीं करनी
302.14,6.7,[संगीत]
305.6,6.68,आती मैं हमजा की काबिल
308.84,7.56,नहीं हमजा बहुत काबिल है
312.28,5.0,दादी उसके लिए तो उसकी तरह की बीवी होनी
316.4,3.2,चाहिए थी
317.28,5.759,[संगीत]
319.6,10.319,ना जैसे
323.039,8.6,समी है ना अला तू भी बिल्कुल अकल की अमीन
329.919,5.921,करर कहां से आ
331.639,8.68,गया तुझे नहीं पता तेरे जैसा तो कोई कोई
335.84,9.56,होता है जितनी तू बे गर्ज है हमदर्द है
340.319,8.851,मासूम है तेरी नहीं यह हमजा की खुशकिस्मती
345.4,8.64,है कि अल्लाह ने उसके लिए तुझे चुना
349.17,4.87,[संगीत]
356.199,7.171,है चाबी रह गई थी दादी लेने आया हा याद से
360.4,8.12,जल्दी आा ना घर जी खुदा
363.37,7.47,[संगीत]
368.52,8.799,हाफिज
370.84,6.479,सा आओ मैं छोड़ द तुम मुझे छोड़
377.759,5.521,चुके मैं ड्रॉप करने की बात करर अकेली
381.12,4.12,कहां जाती रहोगी मेरे अकेले होने का तब
383.28,4.96,सोचना चाहिए था जब हाला से निकाह कर रहे
385.24,3.0,थे
391.12,5.88,मैं तुम्हें यूनिवर्सिटी ड्रॉप करने की
392.919,8.481,बात कर रहा लेट हो रहा हूं
397.0,7.8,चलो लेट मैं हू समीर यूनिवर्सिटी रोड पर
401.4,5.48,जा रहा रास्ते में पढ़ता है तो ॉक कर दूगा
404.8,3.0,मैंने तुम्हारे साथ मंजिल तक जाने का खवाब
406.88,4.84,देखा
407.8,3.92,था रास्ते में उतरने
411.84,5.16,का आइंदा मुझे रास्ते में उतारने की बात
414.68,2.32,भी मत
418.52,5.84,करना मैंने तुम्हें कभी कोई ख्वाब नहीं
420.8,6.44,दिखाया यार जो कुछ था तुम्हारी तरफ से
424.36,7.839,था मैंने तुम्हें कभी इस नजर से देखा ही
427.24,7.04,नहीं है मर्द हो मुक जाओ अगर तुमने हमारी
432.199,3.041,दोस्ती को कुछ और समझा तो इसमें मेरी गलती
434.28,3.919,तो नहीं थी
435.24,6.6,यार व सिर्फ दोस्ती और रिश्तेदारी नहीं थी
438.199,7.44,हमजा उससे ज्यादा भी कुछ नहीं था
441.84,7.88,स कोई एक बात बताओ जब ऐसा लगा हो कि हमारा
445.639,4.081,रिश्ता हमारी दोस्ती से आ गया
451.52,3.72,अम्मी ने कहा था
453.08,5.58,मुझे मना किया ने
455.24,3.42,[संगीत]
460.199,25.241,यार दोस्त मानता
464.2,25.2,[संगीत]
485.44,6.879,परम कहां है चला गया क्या नहीं नहीं वो सो
489.4,2.919,रहा है अपने कमरे
493.879,7.32,में आपको तो पता है कितने दिन हो गए
497.24,7.0,बेचारा बहुत अफसुर्दा है आप बहुत जल्दी
501.199,5.84,चली गई है उनके तो अभी बेटे की खुशियां
504.24,2.799,देखने के दिन
507.919,5.92,थे शफक
510.24,6.26,शक जरा बाहर शॉप प गई है उसे कुछ नोट्स
513.839,15.281,वगैरह चाहिए थे आती ही
516.5,16.779,[संगीत]
529.12,4.159,होगी इसको भी चन नहीं
534.08,3.0,है
537.24,3.79,हेलो जी
539.839,2.841,वालेकुम
541.03,5.69,[संगीत]
542.68,5.159,सलाम नहीं नहीं वो फोन उठाने की कोई बात
546.72,5.0,नहीं
547.839,8.24,है आपको तो पता है घर में बरसे के लिए लोग
551.72,4.359,आ रहे हैं तो बेल की आवाज नहीं
556.43,5.969,[संगीत]
559.399,3.0,आई
563.16,6.72,नहीं सोई हुई आवाज नहीं
565.88,6.36,है रोई हुई आवाज है री मां मेरी कोई मजाक
569.88,2.36,थोड़ी
578.519,3.0,है
582.76,6.519,क्या क्या हो गया मेरा कोई सामान फ्री में
585.68,3.599,थोड़ी रखा हुआ है एडवांस दिया हुआ है भाई
589.68,5.279,मैंने ओ
591.92,7.0,हेलो मुझे भी वहां आने की कोई जरूरत नहीं
594.959,6.841,है मैं मैं अपने घर आ चुका हूं खबरदार अगर
598.92,5.2,मेरे सामान को छुआ भी कोई भी चीज इधर से
601.8,4.8,उधर नहीं होनी
604.12,5.36,चाहिए
606.6,8.04,आदमी
609.48,8.28,अ ाना आप बैठिए ना मुझे बुला लेते आपने
614.64,6.56,क्यों तकलीफ कीने देखो तुम फौरन जाकर
617.76,5.24,मालिक मकान के ड्यूस क्लियर कर दो यह मा
621.2,4.44,वार बिल्स किराया वगैरह अगर जिम्मेदारी से
623.0,5.76,अदा ना किए जाए तो सर चढ़ जाते हैं आप ठीक
625.64,6.0,कह रहे हैं लेकिन मेरे सर पर कुछ नहीं
628.76,5.16,चढ़ा हु हुआ वो सब कुछ एडवांस में निपट
631.64,6.879,जाएगा एडवांस में कटवा दोगे तो फिर रहोगे
633.92,7.719,कैसे मुझे अब वहां रहने की क्या जरूरत है
638.519,5.601,मैं तो अपने घर आ गया आप लोगों के साथ
641.639,4.601,यहां पर तीन दिन सोक के थे फिर तुम्हारी
644.12,5.0,खाला का ध्यान तुम्हारी तरफ लगा हुआ
646.24,6.159,था मेरे ख्याल में अब तुम्हे चले जाना
649.12,8.959,चाहिए ली जा र
652.399,8.081,आप आप अभी तक ा है मुझसे मैं अपनी वजाहत
658.079,5.2,देना चाहता था
660.48,4.72,मुझ पर मुझ पर इंजम था मैं इस मौजू पर बात
663.279,4.761,करने नहीं आया
665.2,5.079,हूं खाना खाकर जाना तुम्हारी खाला ने
668.04,4.56,तुम्हारी पसंद का कुछ बनाया है लू मेरी
670.279,2.321,बात तो
674.1,3.039,[संगीत]
684.88,8.0,सुनो वो देखो उसी दिन वाली लड़की अरे बाइक
688.88,7.24,मगा न ले भगा भगा ना चल चल चल चल चल घुमा
692.88,5.399,के लाता हूं ना लग जाएगी गाड़ी यार उद
696.12,3.88,करना क्या चाहते हो आखिर छोडूंगा नहीं इसे
698.279,4.401,मैं त देख मैं क्या करता हूं इसके साथ
700.0,2.68,देखता जा
707.279,4.56,बस आज बताता हूं इसे कि मैं कौन
712.639,7.64,हूं हां
715.519,9.0,भाई जो अधूरी रह गई थी पूरी कर दूं आज
720.279,7.721,तुम जी जनाब मैं लगता है उस दिन की मार
724.519,6.801,भूले नहीं हो ठीक कहा तुम बिल्कुल भी नहीं
728.0,7.839,भूला तभी तो बदले की कसम खाई
731.32,8.959,है मगर मैं मारूंगा नहीं तुम्हे अब इतनी
735.839,8.161,हसीन और खूबसूरत लड़की पर कौन जालिम हाथ
740.279,3.721,उठाएगा समझ रही हो ना
744.399,8.36,तुम छोड़ उस्ताद अबे आ
749.6,3.159,[संगीत]
754.81,15.469,[संगीत]
767.0,5.48,से उस्ताद शक्ल से ऐसी वैसी लगती नहीं है
770.279,5.521,ऐसी वैसी मतलब कैसी मतलब कहना क्या चाह
772.48,7.159,रहा कुछ नहीं थप्पड़ मारा है उसने मुझे आग
775.8,3.839,लगी है जिगर में आग
785.76,7.4,नाथी खुद क्यों हो गई मुझे बुला लिया
789.56,6.32,होता इतनी सीढ़िया चढ़ के आई हूं सांस फूल
793.16,6.479,गया मुझे बताती ना
795.88,8.759,बैठ तू ऐसे बैठी हुई है तैयार नहीं होना
799.639,6.961,क्या किसलिए खीर की रसम रखवा है हमारे
804.639,6.081,जमाने में तो लड़की दुल्हन की तरह से
806.6,8.32,तैयार होती थी सारी बिरादरी आती
810.72,7.4,दादी रहने दे ऐसे ही ठीक हो अरे क्यों
814.92,5.039,रहने दे खामखा से रहने दे चल दिखा मेरे
818.12,5.64,क्या जोड़ा है तेरे पास
819.959,3.801,चल दादी की बात नहीं
825.76,3.319,माने उठा
829.519,5.721,मुझे खाला जान अगर आप खालू जान को
833.32,5.28,समझाएंगे तो वो
835.24,4.36,समझेंगे कोशिश तो कीजिए बेटा तुम्हे क्या
838.6,3.679,लगता
839.6,6.32,मैंने कोशिश नहीं की
842.279,6.321,होगी मैं बहुत शर्मिंदा हूं इस घर में आप
845.92,4.33,लोग का बेटा बनकर रहना चाहता हूं आप लोग
848.6,4.87,के साथ
850.25,3.22,[संगीत]
854.959,5.361,में हम तुम्हें यहां पर यह सोच कर नहीं
857.8,5.32,लाए थे कि तुमसे इसका कोई बदला चाहेंगे
860.32,4.959,कालू
863.12,6.279,जान माफ कर
865.279,6.641,देना व हम कर चुके हैं जभी तो तुम इस घर
869.399,2.521,के अंदर खड़ी
875.079,4.32,हो
876.9,5.9,[संगीत]
879.399,5.921,मैं मैं अम्मी की आखिरी ख्वाहिश को पूरा
882.8,2.52,करना चाहता
885.36,6.399,हूं शफक
887.44,6.639,से शफक से शादी करना चाहता
891.759,5.0,हूं शफक से
894.079,7.76,शादी शफक का रिश्ता तय हो चुका है
896.759,5.08,बरखुरदार आइंदा ऐसी बात भी मत करना
903.36,8.12,क्या खजाने क्या
907.56,6.8,क्या आते जाते रहना गलत में कामयाब करे
911.48,5.68,अच्छा मैं नमाज पढ़ने जा रहा हूं मस्जिद
914.36,5.599,कमेटी का इजलास है उसके बाद तो मेरे पास
917.16,6.239,चाबी है डोंट वरी अल्लाह हाफिज अल्ला
919.959,3.44,हाफिज मेरी बात तो
925.399,4.44,सुने
926.92,5.159,ये ये क्या कह रहे थे आप आप लोगों ने आप
929.839,6.761,लोगों ने शफा का रिश्ता तय कर दिया बेटा
932.079,7.12,मैंने नहीं तुम्हारे खालू ने न खाला जीन
936.6,6.0,आप कैसे मान गई बेटा तुमने मुझे इन लोगों
939.199,3.401,के आगे बोलने के लायक छोड़ा ही
944.58,4.699,[संगीत]
946.279,3.0,कब
949.8,4.839,और शफक मांग गई
960.21,5.349,[संगीत]
966.279,4.12,आओ समन
968.68,5.639,आओ
970.399,6.321,वाह बड़ा हक जताना आ गया है तुम्हें मुझे
974.319,5.721,कह रही हो
976.72,7.4,आओ क्या हुआ है समन यह पूछो कि क्या नहीं
980.04,5.76,हुआ है तुमने मुझसे हमजा को छीन लिया हमजा
984.12,3.719,कहते है कि उसने आज तक मेरे बारे में ऐसा
985.8,4.44,सोचा तक नहीं खुद ठंडे कमरे में बैठ के
987.839,4.761,सिंगार कर रही हो और मैं इस घर से बाहर तक
990.24,4.32,नहीं निकल सकती क्योंकि बाहर वो मैंने
992.6,4.56,क्या कर दिया तुम्ही ने तो सब कुछ किया है
994.56,4.92,हाला मेरा हाल बर्बाद कर दिया है मेरे
997.16,4.479,मुस्तकबिल पर काफ होके बैठ गई हो जो भी
999.48,5.1,हुआ है अल्लाह ने ऐसे ही लिखा था खुद की
1001.639,5.721,चल बाजी को अल्लाह की करनी का नाम मत दो
1004.58,5.42,[संगीत]
1007.36,4.36,हाला समम क्या कर रही हो ये क्या कर रही
1010.0,4.279,हो अभी मैं दिखाती मैं क्या कर रही ये
1011.72,7.0,देखो क्या कर रही हो क्या कर रही हो जमीन
1014.279,4.441,पी ह पागल हो गई हो क्या
1019.24,4.319,तुम्हारी इतनी जुरत कि तुम हमें आंखें
1021.8,3.6,दिखा रही हो
1023.559,6.081,हमें
1025.4,5.37,हाला कहां रह गई है अरे सब इंतजार कर रहे
1029.64,5.899,हैं
1030.77,4.769,[संगीत]
1037.199,6.36,बेटा समीन बेटा क्या बात है तुम तो अच्छी
1041.12,5.88,भली यूनिवर्सिटी गई थी तो इतना क्यों
1043.559,5.681,भड़की क्यों ना भड़क ताई जान आपको पता है
1047.0,5.12,आज मैं किस तरीके से हला से अपने को बचा
1049.24,5.28,के पहुंची हूं बात-बात में वो मुझे हरा सा
1052.12,4.36,करता है मैं हमजा को बताऊंगी मैं पूरे घर
1054.52,4.159,वालों को बताऊंगी कि इस मासूम हाला का
1056.48,4.24,बोया हुवा मुझे काटना पड़ रहा है नहीं
1058.679,4.441,नहीं नहीं नहीं समीन किसी को मत बताना कोई
1060.72,5.12,तुम्हारा यकीन नहीं करेगा उल्टा तुम्हारी
1063.12,4.48,बदनामी होगी क्यों नहीं करेगा कोई यकीन
1065.84,3.64,मैं नहीं अब डरूंगी जब मैंने कुछ गलत नहीं
1067.6,3.8,किया तो मैं क्यों डरूं नहीं नहीं नहीं
1069.48,5.0,मेरी बात सुनो मेरी बात सुनो
1071.4,5.68,समी अगर अगर सोफिया को और जलीस को यह बात
1074.48,4.72,पता चली तो वो तो हाथ पांव छोड़ देंगे और
1077.08,4.839,क्या पता वो बदनामी के डर से तुम्हारा घर
1079.2,2.719,से ही निकलना बंद
1088.03,6.97,[संगीत]
1091.08,7.24,करते एक बात आप लोग कान खोल करर सुन ले यह
1095.0,5.96,लड़की मेरी बीवी है और किसी ने अब उससे
1098.32,7.0,ऐसा सलूक किया ना तो मुझसे बुरा कोई नहीं
1100.96,4.36,होगा चलो ला
1106.78,9.12,[संगीत]
