Start Time (s),Duration (s),Text
1116.84,8.959,ये मेरा तेरे दिल से जा मिला है रब से
1122.039,3.76,जिसको मांगा
1129.0,6.679,तू माशाल्लाह
1131.76,7.6,माशाल्लाह हाला खीर तो तुमने बहुत अच्छी
1135.679,3.681,बनाई है मेरे बच्चे
1140.52,6.24,ये क्या हो रहा है यहां क्या हो रहा हैसे
1142.6,6.6,क्या मतलब खैर से हाला ने आज खीर पकाई है
1146.76,6.36,अपनी घरेलू जिम्मेदारियां का आगाज कर रही
1149.2,9.719,है आज से आ तू भी खा ले बल्कि इसके हाथ पर
1153.12,5.799,पैसे रख चल हाला डाल के दे खीर इन दोनों
1160.76,9.84,को अमी बहुत मजे के खीरा है आप भी खाए ना
1165.679,8.441,और हाला भाभी आपके हाथ में कितना जायका है
1170.6,4.8,वैसे आज आप लक भी कितनी प्यारी रही है है
1174.12,4.64,ना
1175.4,3.36,समी ता
1179.55,9.85,[संगीत]
1184.559,8.48,जान रे अल्लाह क्या कर रही है अ सोफिया
1189.4,5.24,संभाल अपनी बच्ची को पागल तो नहीं हो गई
1193.039,5.721,ये
1194.64,5.88,सुमीन क्या कर रही हो ये क्यों गिरा दिया
1198.76,4.76,मेरा ख्याल है कि प्याला बहुत गर्म था ना
1200.52,5.32,तो इसके हाथ से छूट गया है ना नहीं प्याला
1203.52,4.71,बिल्कुल ठीक था मैंने जानबूझ के खीर गराई
1205.84,3.92,है बल्कि मैं दोबारा भी गि आऊंगी सु
1208.23,5.65,[संगीत]
1209.76,8.919,स रिस्क की बेहुरमति होती है अच्छा कर
1213.88,7.4,देती तुम सोचती क्या हो खराब है रा इसके
1218.679,4.801,सोच क्या है हिम्मत कैसी हुई है तुम्हारी
1221.28,4.36,आला को हाथ लगाने की अरे अरे क्या हो गया
1223.48,6.0,यहां पर सारे के सारे पागल हो गए हो क्या
1225.64,7.36,जा यहां से एक बात आप लोग कान खोल कर सुन
1229.48,7.88,यह लड़की मेरी बीवी है और किसी ने अब उससे
1233.0,4.36,ऐसा सलूक किया ना तो मुझसे बुरा कोई नहीं
1238.559,3.0,होगा
1242.46,8.38,[संगीत]
1246.559,6.641,चलो तौबा तौबा सारी खीर का जायका खराब कर
1250.84,5.64,दिया और तू क्या खड़ी देख रही है यहां पर
1253.2,5.42,शाहजन जा यहां से नहीं देखनी मैंने तेरी
1256.48,5.24,शक्ल
1258.62,6.179,[संगीत]
1261.72,5.24,समीन समीन बेटा क्या हो गया है सुबह तो
1264.799,4.961,बिल्कुल ठीक गई थी कभी तुमने ऐसे नहीं
1266.96,4.76,किया क्या हुआ है ऐसा इससे पहले इसलिए
1269.76,5.68,नहीं किया क्योंकि मेरे साथ य सब कुछ नहीं
1271.72,6.6,हुआ जो अब हो रहा है मेरे किरदार पर इजाम
1275.44,5.839,लग गया जिस शख्स का नाम मेरे होश संभालते
1278.32,4.52,ही मेरे कानों में फूक दिया गया व शख्स
1281.279,4.201,मेरे से छिन
1282.84,6.28,गया इससे कैसे छिन
1285.48,5.92,गया मैं लाक दूंगी हमजा को तुम्ह मेरा
1289.12,5.799,वादा है
1291.4,8.399,तुमसे बेटा हमजा कल भी तुम्हारा था और
1294.919,8.281,आइंदा भी ना वो कल मेरा था ना व आइंदा
1299.799,7.0,मेरा होगा ऐसे क्यों कह रही हो मैंने कहा
1303.2,6.8,ना मैं बिल्कुल भी नहीं मुझे आपके किसी भी
1306.799,5.401,वादे पर यकीन नहीं है ताई जान झूठ बोलती
1310.0,2.2,है
1314.72,6.64,आप आपको पता है कि हमजा ने मेरे लिए इंकार
1319.4,4.2,कर दिया था और उन्होने यह बात हमसे छुपाई
1321.36,3.76,थी
1323.6,5.84,क्या
1325.12,7.36,जी ये हमसा ने मुझे खुद बताया था नहीं
1329.44,5.62,नहीं नहीं क्या नहीं क्या नहीं नहीं सुनना
1332.48,6.64,चाहती लानत भेजती हूं मैं हमजा
1335.06,6.979,[संगीत]
1339.12,4.32,पर लेकिन अब इस मुसीबत का क्या करूं जो
1342.039,5.161,गले पड़
1343.44,6.809,गई कौन सी मुसीबत बेटा
1347.2,3.049,[संगीत]
1350.72,5.959,बोलो ना अब कौन सी
1352.799,3.88,मुसीबत कोई मुसीबत
1361.72,6.0,नहीं मुझे तो जमीन की बहुत फिक्र हो रही
1364.48,7.52,है ऐसे तो नहीं करती है हमजा ने समीन के
1367.72,8.04,लिए इंकार किया था आप और कितनी चीज छुपाए
1372.0,6.72,एक ही दफा बता दे ताकि सदमा ना हो कोई गलत
1375.76,5.56,फहमी हुई है मैंने कहा ना सोफिया मैं सब
1378.72,7.839,कर दूंगी आपके सब इरादे कल पर क्यों रुके
1381.32,9.599,हैं कर देंगी बोलेंग सुनेगी जबकि आपकी बहू
1386.559,7.041,आज में जी रही है अगर कुछ करना है तो कर
1390.919,6.441,गुजरे वरना आप पछताएंगे
1393.6,7.079,सफिया मैं गलत नहीं कह रही वो लड़की हर
1397.36,6.799,गुजरते दिन एक कदम आगे बढ़ रही है आपको
1400.679,6.761,जवाब देने लगी है बेखौफ से आंखों में
1404.159,6.161,झांकती है और समीन के साथ बात करते घराती
1407.44,4.87,है उस ने आपको दीवार पर लगा देना बल्कि
1410.32,10.68,दीवार से पार
1412.31,8.69,[संगीत]
1421.12,8.84,मैं समीन को क्या हो गया सोफिया अम्मा
1425.0,4.96,नीचे इतना शोर मचा रही है कुछ नहीं
1432.559,7.48,अरे पता नहीं समीम को क्या हो गया ना
1436.44,8.1,गुस्सा क्यों आ रहा था ठीक कर देती
1440.039,8.27,हू छोड़ो इसे इधर
1444.54,3.769,[संगीत]
1450.39,5.289,[संगीत]
1452.84,4.8,आओ मेरी गैर मौजूदगी में ये सब कुछ होता
1455.679,4.461,है तुम्हारे
1457.64,3.76,साथ
1460.14,3.38,[संगीत]
1461.4,7.8,नहीं बस आज
1463.52,6.86,ही हला अपना दफा करते हैं
1469.2,2.52,दुश्मनों
1470.38,5.06,[संगीत]
1471.72,7.559,से यह तो अपने है
1475.44,3.839,ना लेकिन मैं अपना नहीं
1480.72,6.16,हूं क्या कह रही थी सुबह दादी
1483.88,7.799,से मैं तुम्हारे काबिल नहीं
1486.88,7.12,हूं नहीं नहीं मैं यह नहीं कह रही थी मैं
1491.679,5.6,तुम्हारा नहीं कह रही थी मैं खुद का कह
1494.0,3.279,रही थी
1498.52,8.759,मैं तुम्हारे काबिल नहीं
1501.84,5.439,हूं और ये काबिल एगजैक्टली होता क्या
1509.24,6.12,है बराबर हो
1511.6,7.03,ना ठीक कह रही है हम बराबर नहीं
1515.36,3.27,[संगीत]
1518.88,4.519,हो क्योंकि तुम बहुत खूबसूरत हो
1526.36,4.4,आला तुम बहुत खु खरत
1530.88,5.81,हो आंख में लग जाएगी
1534.32,4.52,किसी हम बराबर नहीं
1536.69,7.589,[संगीत]
1538.84,10.319,है मैं तुम सबसे अलग हूं मैं उस दिन तुम
1544.279,7.4,तु सबसे बिल्कुल अलग लग गरई थी मुझे उन
1549.159,5.441,चीजों के बारे में नहीं पता जिनके बारे
1551.679,7.921,में तुम लोग बातें कर रहे
1554.6,11.28,थे मैं पढ़ी लिखी नहीं हूं
1559.6,8.959,मुझे नहीं पता कि ओलिंपिक कहां हो रहा है
1565.88,5.12,और पॉलिटिक्स
1568.559,7.12,का नहीं पता
1571.0,8.52,मुझे नहीं पता कि क्या इन है
1575.679,6.041,आउट मुझे तो अंग्रेजी भी नहीं
1579.52,4.8,[संगीत]
1581.72,5.64,आती और
1584.32,5.83,ये अंग्रेजी कब से डिसाइड करेगी कि कौन
1587.36,4.439,किसके काबिल है
1590.15,4.17,[संगीत]
1591.799,8.181,मोहब्बत किसी जुबान की मोहताज नहीं है
1594.32,7.76,ला वरना गू इजहार को तरसते
1599.98,6.02,[संगीत]
1602.08,6.36,नहीं देखो मैं जानता
1606.0,4.64,हूं यह रिश्ता जिन हालात में हुआ है
1608.44,3.48,तुम्हारे जहन में उभरने वाले सब ख्यालात
1610.64,3.68,जायज
1611.92,5.6,[संगीत]
1614.32,4.17,आई मगर खुदा की कसम यह रिश्ता मैंने पूरे
1617.52,5.989,दिल से अपनाया
1618.49,5.019,[संगीत]
1623.96,4.88,हां शायद इसमें भीभी मोहब्बत नहीं है
1625.72,6.04,क्योंकि हम एक दूसरे को जानते नहीं
1628.84,6.16,है थोड़ी कोशिश तुम करो थोड़ी मैं करता
1631.76,3.24,हूं मोहब्बत भी हो जाएगी
1635.88,7.08,हा और सबसे इंपॉर्टेंट
1639.0,8.159,बात मेरे बारे में मुझसे सवालात
1642.96,6.439,करो मुझे जानने के लिए मुझसे
1647.159,4.561,पूछो हादी से तो ज्यादा ही अच्छा बता
1649.399,2.321,दूंगा
1654.6,8.559,ना एक काम करते
1658.36,8.48,हैं आओ खाना खाने चले गई बहर आओ नहीं मगर
1663.159,10.43,यह कमरा आकर कर
1666.84,6.749,[संगीत]
1676.86,3.17,[प्रशंसा]
1681.0,6.36,क्या कर झे तुम बात करनी तुम को बात
1685.799,5.36,नहीं
1687.36,3.799,प्लीज क्या बात करनी है
1692.399,6.841,तुमने जान ू जान कह रहे थे तुम्हारा
1696.0,7.039,रिश्ता होने जा रहा है हा हो रहा है मेरा
1699.24,6.439,रिता मुझसे मोहब्बत करती हो ना
1703.039,5.841,मोहब्बत मोहब्बत मैं करती थी
1705.679,5.641,तुमसे लेकिन तब मुझे य नहीं बताता कि तुम
1708.88,5.0,हाला से मोहब्बत करने लगे हो ला हाला से
1711.32,4.44,हाला से मैं मोहब्बत नहीं करता नहीं करता
1713.88,4.519,मैं उससे मोहब्बत अरे वो खुद मेरे पीछे
1715.76,4.799,पड़ी हुई थी तुम्हारे पीछे पड़ी हुई थी
1718.399,5.76,तुमने उसे अपने पीछे लगाया था
1720.559,5.401,समझे झूठ झूठ बोलती है वो झूठ बोलती है
1724.159,5.36,हाला कभी झूठ नहीं
1725.96,5.24,बोलती और बासी कड़ी को उबाल मत दो अब मुझे
1729.519,5.16,तुमसे इस मौजू पे कोई बात नहीं करनी है
1731.2,5.079,हटो जगह दो प्लीज प्लीज शफक मोहब्बत को
1734.679,4.0,बासी कह
1736.279,5.12,रही मोहब्बत
1738.679,2.72,गलती पर बहुत
1741.48,6.28,शर्मदा गलती कौन सी गलती किस बात की माफी
1746.12,5.12,मांग रहे हो अभी तो तुमने कहा सब कुछ हाला
1747.76,5.96,नहीं किया था मेरी दोस्त तो इतनी मासूम थी
1751.24,5.439,कि तुम उसकी तरफ अट्रैक्ट हो सकते थे
1753.72,6.76,लेकिन तुम्ह पता है इस वक्त तुम्हारा मसला
1756.679,7.681,हाला या शफक नहीं है तुम्हारा मसला इस
1760.48,6.84,वक्त तुम्हारी खाली जेब है मैं देर से
1764.36,5.679,लेकिन तुम्हें समझ गई अब बहुत देर हो चुकी
1767.32,6.88,है मुझसे मोहब्बत का इकरार करके तुम अपने
1770.039,8.281,मसले हल करना चाहते हो ना मैं इकरार नहीं
1774.2,7.64,कर मैं अब्बा की मर्जी पर राजी
1778.32,3.52,हूं हटो मेरे
1782.24,10.24,सामने तु मेरे साथ जती कर रही
1786.12,6.36,हो वो तुमने खुद के साथ खुद
1794.919,4.0,की हटो
1800.57,12.15,[संगीत]
1815.279,8.021,वो
1817.45,5.85,[संगीत]
1825.919,6.48,देख अरे भाई
1828.84,3.559,मुझे क्यों मरवाना इस वक्त रात
1832.84,6.8,को अी बात भी है आपसे बात कर रहा हूं
1836.24,6.279,एक्सक्यूज मी हेलो आपसे देख के भाई हां
1839.64,2.879,ठीक है
1844.06,3.11,[संगीत]
1847.44,10.099,ठीक देख के भाई
1850.6,6.939,[संगीत]
1860.039,6.401,खुदा हाला का बेड़ा गरक करे बददुआ तो मत
1864.12,5.559,दो बददुआ ना
1866.44,6.479,दू आज उस हाला की वजह से हमजा ने मेरी
1869.679,4.84,बेटी पर हाथ उठाया मेरी लाइक फाइक बेटी
1872.919,4.161,अल्ला उसे बर्बाद
1874.519,6.64,करे सुख कुतर
1877.08,7.199,से हाला को बर्बाद होने की
1881.159,7.041,बदवाप बेटी के आबाद होने की दुआए क्यों
1884.279,6.52,नहीं करती करती हूं और क्यों नहीं कर
1888.2,8.199,करूंगी मेरी दुआएं मेरी बेटी के लिए तो
1890.799,7.521,हैं दुआ के साथ दवा भी करनी होगी जी समीन
1896.399,5.601,को आगे बढ़ना
1898.32,5.4,है हमें उसे बताना है कि हमजा कोई नहीं
1902.0,5.84,भूल जाए
1903.72,4.12,उसे ये आप क्या कह रहे
1908.0,5.24,हैं
1909.679,5.561,सोफिया हम अपनी बेटी को सारी जिंदगी हमजा
1913.24,4.24,का नाम ले लेकर रोने के लिए नहीं छोड़
1915.24,3.52,सकते ना तुम समझ रही हो ना मैं क्या कह
1917.48,3.12,रहा हूं
1918.76,5.72,कहां है वो बुलाओ
1920.6,6.24,उसे यूनिवर्सिटी चली गई
1924.48,4.919,है
1926.84,5.36,यूनिवर्सिटी अभी तो सुबह ही उसने कहीं भी
1929.399,4.641,जाने से मना किया था मैंने उसको इतना रोका
1932.2,4.96,ले व गुस्से भी निकल
1934.04,3.12,[संगीत]
1937.279,8.64,गई है फूल में डरे जा रही हूं बार उससे
1941.6,4.319,मुझे कुछ कहा तो सीधा पुलिस में दे दो
1953.79,14.609,[संगीत]
1964.36,7.159,कोई नहीं है यहां और ना कोई आएगा बहुत घूम
1968.399,3.12,फिर के तुम्हें यहां घेरा है
1971.639,5.121,मैंने
1973.32,5.88,बचाओ बकवास बंद करो अप वरना यही काट के रख
1976.76,4.519,दूंगा समझी
1979.2,6.12,क्या क्या चाहते हो
1981.279,6.76,हाय चाहा तो बहुत कुछ था मगर अब कुछ और
1985.32,2.719,चाहता हूं
1989.72,6.6,बच्चा खामोश उस्ताद खड़े खड़े टाइम जाया
1993.399,4.201,नहीं करो डालो उसको गाड़ी में आ जाएगा कोई
1996.32,5.44,उसको गाड़ी में कोई आ जाएगा नहीं मुझे
1997.6,4.16,छोड़ दो मुझे अला का वास्ता मुझे छोड़ दो
2004.12,7.48,छोड़
2006.76,4.84,मुझे को को
2011.99,23.359,[संगीत]
2037.53,14.109,[संगीत]
2053.8,22.339,[संगीत]
2078.32,12.95,[संगीत]
2094.119,6.601,सॉरी क्या हो जाता तुम्हें अभी इतना अच्छा
2098.079,5.0,टाइम गुजार के आए हैं तुम इतनी डाउन क्यों
2100.72,4.119,हो जाती हो
2103.079,6.52,ऐसे
2104.839,4.76,नहीं कुछ नहीं कुछ
2109.96,6.0,नहीं सर में दर्द
2112.88,7.68,है थक गई हूं
2115.96,7.56,ना हां थको गी ना सारा दिन जब किचन में
2120.56,8.39,खड़े होकर खीर बनाओगी तो थको गी आराम नहीं
2123.52,20.16,करती हो तुम आराम करो लेटो न टू स्लीप यू
2128.95,14.73,[संगीत]
2146.68,7.96,नो कितनी नफरत रम की आंखों में मेरे
2151.28,7.12,लिए वैसे सारे दुख दर्द दूर हो
2154.64,5.64,गए लेकिन
2158.4,3.959,य चेहरे पर
2160.28,2.72,मुस्कुराहट ये तुम्हारे चेहरे से जुदा
2162.359,2.72,नहीं
2163.0,5.96,ई
2165.079,6.801,ला तुम मैं ही मिला था धोखा देने के लिए
2168.96,7.72,वैसे क्या हैप्पी लाइफ
2171.88,7.719,है ऑस्ट्रेलिया पलट कजन से निकाह हो
2176.68,7.12,गया सारे दुख दर्द दूर हो
2179.599,8.041,गए तुम्हारी वजह से मेरी जिंदगी उ चड़ गई
2183.8,9.2,घर से बेघर हो गया मेरी मां सदमे में आकर
2187.64,5.36,सर से लग ग और इस सबकी जिम्मेदार तुम
2193.78,6.78,[संगीत]
2199.0,5.4,तुम
2200.56,7.44,प्लीज प्लीज मुझे रम की बद नियती और बद
2204.4,5.28,नजरी से दूर रखिएगा सिर्फ मुझे नहीं मुझे
2208.0,5.38,और हमजा दोनों
2209.68,6.12,को खुरम की आंखों से खौफ आता
2213.38,5.979,[संगीत]
2215.8,6.85,है प्लीज प्लीज अलाया जी मेरे प्यारे
2219.359,21.801,अलाया जी प्लीज
2222.65,20.949,[संगीत]
2241.16,5.36,प्लीज
2243.599,6.881,शफक कैसे बताऊं मैं
2246.52,7.559,तुम्हे कसे बताऊ कि तुम बिल्कुल ठीक कहती
2250.48,6.68,थी तुम ठीक कहती थी कि हमजा से शादी करके
2254.079,3.081,मेरे सारे दुख दूर हो
2257.319,5.841,जाएंगे कैसे बताऊं मैं
2259.92,7.6,तुम तुम ठीक थी और मैं बहुत खुश हूं और
2263.16,10.08,हमजा बहुत अच्छा है दिल ये मेरा तेरे दिल
2267.52,13.44,से जा मिला है रब से जिसको मांगा तू वो
2273.24,12.72,सिला है तकदीर जब से से जुड़ी है जाम
2280.96,5.0,मोहब्बत जहे आशकी
2286.4,6.08,है उन्होंने कहा था मुझे जला देंगी मैंने
2289.92,4.64,भी उनको कहा कि उन सासों को पुलिस लेकर
2292.48,4.0,चली जाती है तना अच्छा जवाब दे तो दिया कि
2294.56,5.12,अगर ऐसा कुछ हुआ तो पुलिस ले
2296.48,7.44,जाएगी तो इसम मेरा क्या फायदा होगा मैं तो
2299.68,4.24,जल के मर चुकी हूंगी मैं तुम्हे मरने
2304.92,5.36,दूंगा तुम ना बस मुझे एक बार ख से मिलवा
2308.119,4.841,दो मैंने उसकी आंखों में हाला के लिए तड़प
2310.28,5.039,देखी है और नाकाम इंसान जख्मी नाक से
2312.96,5.159,ज्यादा खतरनाक होता है वो हाला को अपना
2315.319,5.721,लेगा परम सिर्फ मेरा कजिन नहीं था मेरा
2318.119,4.72,मंगेतर भी था ये नहीं हो सकता ये लोग ये
2321.04,4.12,लोग यहां शादी नहीं हो सकती भूल गए हैं आप
2322.839,4.441,लोग इन्हें रूमी के लिए बुलाया था बस
2325.16,3.4,ताल्लुक रखना है या नहीं रखना है इसका
2327.28,4.48,फैसला मैं
2328.56,6.44,करूंगी जिसको आपकी बहू बनना था ना वो बन
2331.76,3.24,चुकी है
