Start Time (s),Duration (s),Text
0.48,8.4,ये मेरा तेरे दिल से जा मिला है रब से
5.64,5.999,जिसको मांगा
8.88,5.04,तूला चलो ठीक है भाई अगर तुम लोग मुतमइन
11.639,4.841,हो और तुम्हारी बेटी भी खुश है तो हम
13.92,5.48,क्यों कुछ कहेंगे जी जी भाईजान बहुत
16.48,5.92,मुतमइन है और हमारी बेटी भी हमारे कहे में
19.4,5.719,है आ जाएगी समझ क्योंकि तलाक का लफ तो
22.4,5.199,बहरी औरत को भी समझ आ जाता हैई जन आप
25.119,5.24,मुझसे बेहतर जानती है कि हमजा के मुंह से
27.599,4.601,य लज मेरे लिए कभी नहीं निकलेगा तोत फिर
30.359,5.081,क्यों बार-बार एक ही बात करके अपने आप को
32.2,6.519,अजियत में डालती मैं कह रही हूं ना तुम
35.44,3.279,मुझसे मेरा बेटा नहीं छीन
38.97,6.55,[संगीत]
41.16,9.12,सकती माला हां क्या हो गया कुछ भूत देख
45.52,10.8,रही हो तुम ये बैठ के पियो दिल ये मेरा
50.28,10.759,तेरे दिल से जा मिला है रब से जिसको मांगा
56.32,4.719,तू वो सिला है
69.68,3.96,अरे
70.84,6.639,वाह आप तो बड़ी फिल्मी मा
73.64,6.64,निकली पोते के आने की खुशखबरी का सुनके बह
77.479,4.96,के सारे गुनाह माफ कर दिए और उसकी सेवा
80.28,5.72,में लग गई अच्छा
82.439,7.961,बस तेरे मुह से यह बातें नहीं जच रही आप
86.0,7.79,भी नहीं जच रही है यह सब करती हुई हां
90.4,7.64,मैं तो आपको बड़ा मजबूत और बातिर समझती
93.79,6.21,[संगीत]
98.04,5.28,थी और
100.0,6.6,दादी देखा सबसे ज्यादा फिल्मी तो यह साबित
103.32,8.839,हुई ओवर नहीं लग
106.6,10.28,रही वैसे फिल्मी मा दो तरह की होती है एक
112.159,9.0,वह जो जिस बात में बह जाती है और दूसरी वो
116.88,4.279,जो सब कुछ बहा देती है
123.0,5.2,हाला से ब जाए तो मुझे भी दे दीजिएगा
126.2,6.36,थोड़
128.2,4.36,अनर वैसे कितने ड्रामे कर रही है
135.16,6.359,ना एक अनार और हम सब बीमार
141.85,9.23,[संगीत]
153.5,4.26,[संगीत]
155.04,5.839,ऐसी हमदर्दी और शफकत मैंने कभी रनी के लिए
157.76,7.32,भी रेस की आंखों में नहीं देखी जो आज हाला
160.879,7.44,के लिए थी है कि नहीं हाला के लिए नहीं थी
165.08,7.12,हाने वाले बच्चे के लिए
168.319,6.881,थी तलवे से चपकी हाला माथे का ूमर बन गई
172.2,6.679,है इस बच्चे की वजह से जो अभी दुनिया में
175.2,6.2,आया भी नहीं है जब आ जाएगा तो फिर हाला का
178.879,6.08,मकाम क्या होगा
181.4,4.73,नहीं नहीं नहीं ये नहीं हो सकता ये नहीं
184.959,5.901,हो
186.13,4.73,[संगीत]
196.02,7.38,[संगीत]
199.36,7.72,सकता मेरे ना तीन बेटे थे जाहिर है कि
203.4,7.119,बेटी की भी ख्वाहिश थी और फिर हमजा आ गया
207.08,8.0,और फिर समीन शुरू शुरू के दिन थे मिजाज
210.519,8.08,दार बहू अपनी मर्जी की मालिक और फिर रूम आ
215.08,6.96,गई ना उसका नाम मत ले इस शाहजन ने पता
218.599,7.401,नहीं उसको क्या घुट्टी दी थी मेरी गोद में
222.04,6.72,आकर ऐसा रोती थी ऐसा रोती थी जैसे कि मैं
226.0,4.68,चुटकियों काट रही हूं उसे शायद आप काटती
228.76,7.839,हो
230.68,10.6,दादी और फिर आ गई हाला और फिर पता चला कि
236.599,4.681,बेटी को रहमत क्यों कहते हैं
242.76,6.64,इधर हाला आ मैं तेरा माथा चूम दादी बुला
247.079,8.201,रही आ
249.4,10.079,जा क्या हुआ क्या हुआ हाला धर से टांग में
255.28,5.96,क्यों पता नहीं शायद नस खिच गई है मसला
259.479,5.481,क्या है मुझे बता
261.24,6.48,बेटा शायद दादी बल पड़ के आओ आओ चलो
264.96,5.88,डॉक्टर के पास चलो ना ना ना ना डॉक्टर के
267.72,5.64,पास जाने की कोई जरूरत नहीं है मैं ह ना
270.84,6.44,दादी दर्द हो रहा है डॉक्टर पर जाना जरूरी
273.36,6.399,अभी मालिश करूंगी बिल्कुल आराम आ जाएगा और
277.28,6.8,डॉक्टर डॉक्टर का नाम मत लेना डॉक्टर ने
279.759,7.601,तो खामखा में 15000 गोलिया दे देनी है
284.08,6.679,के लिए लेकिन दादी अच्छा बस चुप कर तू
287.36,7.679,नहीं बोलेगा यह मेरा और हाला का मामला है
290.759,5.081,हा मैंने तीन तीन बच्चे पैदा किए हैं पाला
295.039,5.641,है
295.84,8.32,उन्हें त बोलती क्यों नहीं है शाहजन
300.68,4.61,हा चल हाला मेरे साथ चल मैं अभी मालिश कर
304.16,12.979,देती हूं तेल
305.29,11.849,[संगीत]
321.759,8.081,की कहती तो नहीं
324.16,7.84,जाता नहीं मैं ठीक हूं कैसे ठीक ह ला दवाई
329.84,5.96,रही हो अपना ख्याल रखती हो ऐसे कैसे ठीक
332.0,6.8,होगा आ नाराज
335.8,3.0,हो
339.12,5.0,द मैं चके जाके
344.7,3.129,[संगीत]
351.16,15.96,[संगीत]
364.28,5.8,पपू की बातें तो तुम रहने ही दो फजूल के
367.12,5.04,देसी टोट के अरे खुद तो उन्होंने डॉक्टर
370.08,4.119,का मुंह देखे बगैर बच्चे पैदा किए थे 50
372.16,5.52,साल पहले कोई जरूरत नहीं है उनके पीछे
374.199,6.481,लगने की लेकिन दादी खफा होंगी अरे होने
377.68,4.88,दोने खफा मुझे बताओ अगर इतनी बुरी है
380.68,3.519,अंग्रेजी दवाएं तो खुद क्यों ंगती रहती है
382.56,4.24,सारा दिन
384.199,4.681,हम हमजा की बार तो फिर भी मैंने उनकी
386.8,4.399,बातें मानी थी लेकिन रूमी की दफा मैंने
388.88,4.24,अपनी मर्जी की अरे भा जिसे तकलीफ होती है
391.199,4.28,उसे ही पता होता है ना क्या करना है ठीक
393.12,4.799,है ना चलो तुम एक गोली तो मेरे सामने खाओ
395.479,7.361,अभी दूसरी शाम को खानी है
397.919,4.921,शाबाश एक फिर शाम को खा लेना याद
407.91,7.25,[संगीत]
410.88,7.759,से और सुनो वो किसी को ना इस बात का पता
415.16,5.96,ना चले हमजा को भी नहीं हमजा को तो
418.639,4.721,बिल्कुल ही नहीं वो तो जाके फौरन फो के
421.12,6.799,आगे सब कुछ बोल देगा फिर मेरी जो शामत
423.36,6.35,आएगी ना अल्ला माफ करे य शाम को खा लेना
427.919,13.621,याद
429.71,11.83,[संगीत]
442.8,7.44,से नहीं नहीं तुम लो ओ मैं
446.199,7.451,लेल हां हां इसको तो छोड़ दे
450.24,5.12,हलवा खाले खास बनाया तेरे
453.65,4.91,[संगीत]
455.36,6.399,लिए दादी इसका दर्द भी ठीक नहीं देसी
458.56,4.45,नुस्खा है कुछ देर तो लगेगी ना फिकर ना कर
461.759,3.84,आराम आ
463.01,5.35,[संगीत]
465.599,6.401,जाएगा अगर यह हैवी चीज खाने को दिल नहीं
468.36,6.48,चाह रहा तो तुम्हारे लिए मैं अंडा बॉल कर
472.0,6.75,दू नहीं
474.84,8.66,नहींन ठीक
478.75,4.75,[संगीत]
487.56,8.13,तुने दवा खा ली थी
490.28,9.82,ना दो दिन में दर्द भाग जाएगा देखना
495.69,4.41,[संगीत]
502.43,6.99,[संगीत]
511.479,8.841,इस टाइम प कौन फो करता
514.919,5.401,है नहीं होता दोपहर में लोग सो रहे होते
532.0,5.08,हैं हेलो
534.36,5.72,कौन इतनी आसानी से बोलने वाली चीज तो नहीं
537.08,3.0,था
540.68,3.02,मेरी तो सांसों की आवाज तक को पहचानने का
542.6,5.84,दावा किया था
543.7,4.74,[संगीत]
550.76,8.319,तुमने कौन रम बात कर नाम तो सुना
556.48,7.28,[संगीत]
559.079,7.401,होगा आज के बाद य पर फोन मत रखना मेरा
563.76,2.72,मुबारकबाद तो ले
567.279,6.24,लो सारे गम दूर हो गए
570.6,4.479,अपने डैड से मिलने जा रही है और वो
573.519,4.041,तुम्हारा
575.079,5.081,हमजा दीवाना है
577.56,6.16,तुम्हारा और इन सबसे बढ़कर
580.16,6.32,अम्मी जान बनने वाली हो भाई मुझे सिर्फ
583.72,5.119,इतना बताओ कि अपने बच्चे से मुझे क्या
586.48,7.96,कहकर मुता करवाओ
588.839,5.601,गी मामू मत कह दे ना सहा नहीं
596.44,8.36,जाएगा मेरे बच्चे का नाम मत लेना
600.48,4.32,आ ममता जाग गई है
613.15,7.08,[संगीत]
620.8,8.92,ना
623.24,6.48,चलो आज के लिए इतना ही काफी है ला
630.37,6.11,[संगीत]
633.839,5.961,तुम छैन नहीं है
636.48,8.08,तुम्हें डॉक्टर लाया हूं चला तुमसे जा
639.8,4.76,नहीं रहा क्या क्या दादी खफा
645.24,4.92,होंगी इस दर्द बर्दाश्त करते चेहरे ने एक
648.04,5.799,पल सुकून से बैठ नहीं दिया
650.16,3.679,मुझे भागा चला
654.12,4.64,आया चलो मिला रहा
663.92,6.64,ड चलने में भी प्रॉब्लम है इसको दर् क्या
667.72,5.2,क्या वज इस दर्द का तालुक इनकी कंडीशन से
670.56,5.36,नहीं है मगर हो सकता है इन्होने कोई वेट
672.92,3.0,उठाया हो या
676.279,6.841,फिर यह डेंजरस होता है आपको किसी ने बताया
679.839,9.081,नहीं एनीवे कोई मेडिसिन कोई पेन किलर
683.12,5.8,इंजेक्शन वगर तो यूज नहीं किया नहीं
690.279,3.921,कौन
691.2,7.199,सी उसका नाम नहीं पता
694.2,4.199,मुझे आप देख ले
698.73,10.63,[संगीत]
706.0,3.36,दिखाय वाली
713.74,4.14,[संगीत]
716.2,5.84,य
717.88,4.16,व्ट ये मेडिसिन यूज कि है
722.16,5.919,तुमने ओ
724.68,7.44,गॉड कहां से लिए है तुमने ये किसने लाके
728.079,7.12,दी है और अभी तक कितनी गोलियां खा चुकी हो
732.12,6.399,क्या है इस दवाई में बच्चे को तो
735.199,5.961,छोड़े इस दवाई से आपकी मिसेस की जान को
738.519,6.281,खतरा है हमेशा के लिए मां बनने की सलाहियत
741.16,7.6,खो सकती है ये हला किसने दी है तुम्हें ये
744.8,4.63,दवाई हला हां क्यों खा रही थी ये दवाइयां
748.76,2.68,हां
749.43,5.13,[संगीत]
751.44,6.079,उन्होने मुझे दे दी तो मैंने लेली किसने द
754.56,5.12,तुम्ह दवाई मेरे साथ ऐ क्यों करगी किसने
757.519,2.161,दिया
760.24,7.11,ई
762.079,6.601,मैंने ी तुम द झ स कुछ नहीं
767.35,3.289,[संगीत]
768.68,6.2,साने
770.639,4.241,मुला किसने दिया
779.32,4.639,क्या क्या बात हो रही है मेरी तो कुछ समझ
781.76,6.92,में नहीं आ रहा हमजा क्या कह रही है यह
783.959,8.32,क्या है सब हमजा से नहीं मुझसे बात करें
788.68,7.2,आपने दी थी ना ये दबा मुझे आपने दी थी
792.279,5.641,अरे ये क्या बदतमीजी है होश में हो तुम
795.88,4.519,देख रहे हो अपनी बीवी की गुस्ताखियां सब
797.92,2.479,देख रहे है
800.519,6.161,हमजा इन्होने दी थी मुझे दबा इन्होंने दी
805.16,5.72,थी
806.68,7.959,मैंने मैंने कब जब मैं दर्द से तड़प रही
810.88,5.92,थी तुम याद जिस दिन मुझे बहुत दर्द हो रही
814.639,4.44,थी इन्होंने मुझे चुपके से बुलाया और कहा
816.8,5.76,कि ये कहा के आराम हो
819.079,5.861,जाएगा तुम इतनी लाडली नहीं हो बीबी कि मैं
822.56,4.92,तुम्हारे लिए नुस्खे तजवीज करती
824.94,6.5,[संगीत]
827.48,7.4,फिरू और तुम हमजा तुम इसके पीछे लगकर अपनी
831.44,3.44,मां से तफ्तीश करने के लिए आ
835.48,5.64,गए ओ अब समझ आई
839.36,4.68,ये अपने बाप के पास जाने के लिए उतावली हो
841.12,5.639,रही थी ना और रुकावट था यह
844.04,5.359,बच्चा तो इसलिए उसने यह रास्ते से हटाने
846.759,5.401,का प्लान बना लिया तुम्हें याद है तुम्हें
849.399,4.68,याद है कैसे आठ आठ आंसू रो रही थी जब फुफो
852.16,5.52,ने कहा यह कहीं नहीं जा सकती और इल्जाम दे
854.079,6.841,दिया मुझ पर मुझ पे नहीं हम सब मैं ये
857.68,7.04,क्यों लूंगी मैं कैसे मंगी
860.92,6.599,य चोर के पास चोर रास्तों की कमी नहीं
864.72,6.2,होती और तुम तो खैर पहले से ही झूठ बोल
867.519,3.401,रही है आप
870.959,4.761,मुझे जान से मारने की कोशिश की हमजा तुम
873.639,5.56,मेरी बात के यकीन क्यों नहीं कर रहे बकवास
875.72,5.72,कर रही है ये मुझे क्या जरूरत है जरूरत है
879.199,4.56,अने तो जरूरत के बगर भी मेरी जिंदगी
881.44,5.44,जहन्नम की हु
883.759,5.961,है कैसी कैसी सजाए नहीं देती थी आप मुझे
886.88,6.639,इसका दिमाग लट जो मु में आ रहा बके चली जा
889.72,8.679,रही है आप जानती नहीं रही
893.519,4.88,हूं मेरी बात का यकीन करो
899.839,7.201,मैं दादी को बताती
902.12,4.92,हूं दादी को नहीं बुलाना मैं दादी को
907.399,4.911,बुलाऊंगा मेरी बात का यन करने वाली बात भी
910.079,5.301,तो करो
912.31,3.07,[संगीत]
916.48,8.32,ला मेरी मां है यार नहीं कर सकती मेरे साथ
920.72,4.08,ऐसा तुमहे समझ क्यों नहीं आ रही
927.46,11.02,[संगीत]
936.399,5.521,तुम्हारी पेंसिल के छोटे छोटे टुकड़ों को
938.48,5.96,संभाल कर रखू मनी मां तुम्हारे बच्चे के
941.92,6.08,साथ ऐसा कर सकती है
944.44,8.319,भला बच्चा क्या मेरा कुछ नहीं लगता
948.0,4.759,हमसा झूठ बोल रही औरत झूठ है य
954.36,6.32,औरत एक लज और नहीं बोलोी तुम एक लज और
958.04,5.56,नहीं बोलोी तुम
960.68,6.48,एक लफ और नहीं चलो य
963.6,3.56,से चलो यहां
968.52,8.879,[संगीत]
974.04,3.359,से आई
977.7,5.299,[संगीत]
985.519,5.361,सरी मुझे कभी पसंद नहीं करती थी
991.319,5.52,मेरी जान लेने की कोशिश
994.079,8.281,करेंगी यह मैंने नहीं सोचा
996.839,9.12,था ला तुम्हें कोई गलतफहमी हुई है
1002.36,9.52,नहीं कोई गलतफहमी नहीं
1005.959,10.921,हुई व मेरे साथ इससे भी ज्यादा बुरी
1011.88,5.0,थी पूरा पूरा दिन में इस पर खड़ा कर देती
1017.36,6.28,थी कभी रे कोने में मुंह करके खड़ा कर
1021.519,4.8,देती थी
1023.64,7.64,लो
1026.319,8.561,नहीं मुझे बोलना है ना बोलने दो मुझे
1031.28,5.399,बोलना है हमजा मुझे बोलना है तुम्हें नहीं
1034.88,5.039,पता तुम्हें पता है वो मेरे साथ क्या करती
1036.679,5.0,थी मुझे कहती थी कि बार-बार बोलो कि
1039.919,3.64,तुम्हारा नाम हाला नहीं है तुम्हारा नाम
1041.679,3.52,झूठी है और मैं बार-बार बोलती थी मेरा नाम
1043.559,4.441,हाला नहीं है मेरा नाम छूटी है मेरा नाम
1045.199,5.041,हाला नहीं है मेरा नाम छूटी है नहीं नहीं
1048.0,5.44,बहुत सु
1050.24,6.559,और क्या करती थी मुझे कहती थी कि कागज प
1053.44,6.68,100 दफ लिख स दफ लिख क्या ला फालतू है मैं
1056.799,5.401,लिखती रहती थी हला फलत है हला फल हला फलत
1060.12,3.559,है तुम्ह यकीन नहीं आ रहा ना तुम्ह यकीन
1062.2,7.719,नहीं आ रहा मेरे पास वो कागज पड़े मैं
1063.679,11.24,तुम्ह कागज चुप कर जाओ यार चुप बिलकुल
1069.919,9.201,चुप नहीं करूंगी चुप नहीं करना मुझे
1074.919,7.24,चु नहीं तुम समझ नहीं रहे हो तुम ल मैं
1079.12,6.0,झूठ बोल रही हूं मैं झूट नहीं बोल रही मैं
1082.159,6.121,झूठ नहीं बोल रही उन्होंने पूरी जिंदगी
1085.12,7.559,मेरे साथ यही किया है तुम्हारी मां इस
1088.28,4.399,दुनिया की सबसे ज्यादा जालिम और बरी औरत
1093.799,5.321,है अगर तुमने मेरी मां के बारे में दोबारा
1096.6,7.28,यह लज इस्तेमाल किया तो मुझसे बड़ कोई
1099.12,4.76,नहीं होगा समझ तुम
1110.96,9.65,[संगीत]
1115.84,7.319,खबरदार अगर ये बात किसी और के सामने की तो
1120.61,5.91,[संगीत]
1123.159,7.361,खबरदार आज के बाद समझाऊ
1126.52,4.0,निला बस
1136.11,45.58,[संगीत]
1196.799,3.681,अस्सलाम वालेकुम
1199.2,5.0,अस्सलाम
1200.48,6.199,वालेकुम क्या बात है समीना आप आप कुछ
1204.2,6.479,परेशान सी लग रही
1206.679,5.841,है आपको ऐसे बगैर कहे कैसे पता चल जाता कि
1210.679,4.88,मैं परेशान
1212.52,6.08,हूं ल इस बात का जवाब हम किसी और वक्त के
1215.559,6.161,लिए छोड़ देते हैं अभी आप बताए मसला क्या
1218.6,4.559,है मसला यह है कि अबू डॉक्टर के पास उनकी
1221.72,3.48,बहुत इंपोर्टेंट रिपोर्ट जो डॉक्टर को
1223.159,3.561,दिखानी वो मेरे पास है और मेरी इतनी
1225.2,4.0,पोर्टेंट क्लास है अगर मेरा उसे मिस कर
1226.72,6.28,दिया तो मैं और मैं अभ क तो मैं टाइम पे
1229.2,6.44,नहीं पहुंच पाऊंगी समीन आप आप एक काम
1233.0,3.64,कीजिए आप आप जाकर क्लास लीजिए ये रिपोर्ट
1235.64,5.64,मुझे
1236.64,6.48,दे आर यू शर यस यस गिव इट टू मी मैं मैं
