Start Time (s),Duration (s),Text
811.48,5.44,है कहां से आए आप लोग ऐ वो वाला बोल ये
815.12,6.11,कहां आया?
816.92,7.439,मा अरे आप लोग को
821.23,3.129,[संगीत]
824.92,3.0,अरे
829.56,5.819,रुको देखते हैं
831.98,3.399,[संगीत]
840.76,7.4,रे ऐ रुको ए अरे बताओ ना मुझे कौन लोग आप
845.279,6.56,लोग अरे बताओ ए ऐ कौन है आप लोग ए बताओ ना
848.16,5.76,ऐ अरे वो वो क्या वो गोली में क्या रखा है
851.839,5.281,अरे बताओ ना मैं कब से पूछ रहा हूं वो
853.92,7.0,क्या है गोली में क्या रखा है अरे बताओ ऐ
857.12,3.8,अरे बताओ ऐो
861.92,6.76,अरे ऐ आो जाने दीजिए आप ऊपर आ जाइए
868.959,4.481,अरे देखिए कौन थे ये लोग क्या था वो गोली
871.199,3.641,में क्या है क्या ताऊ दे है ना तुम यहां
873.44,8.16,पर
874.84,11.16,[संगीत]
881.6,7.28,बाप रे इतना भारी है। क्या होगा ग इसमें?
886.0,4.88,आइए खोल के देखते हैं। नहीं नहीं सुनो हाथ
888.88,3.44,मत लगाना। बिलकुल हाथ मत लगाना। क्यों?
890.88,4.48,अरे क्यों? क्या क्यों? पता नहीं क्या है
892.32,5.92,इसमें? अगर कोई खतरनाक चीज हुई इसमें तो।
895.36,6.0,अरे बाबा ऐसे दिन में खुलेआम कोई खतरनाक
898.24,6.399,चीज घर पे थोड़ी ना रख के जाएगा। और वो भी
901.36,4.96,इतनी चार-चार बोरियां भर के। फिर भी रिस्क
904.639,4.401,क्यों ले ले ना माधुरी जब पता ही नहीं
906.32,4.759,इसमें क्या है? ये बिना खोले कैसे पता
909.04,6.68,चलेगा कि इसमें क्या है?
911.079,4.641,एक्सक्टली मैं देखता हूं।
916.21,15.71,[संगीत]
928.16,6.64,क्या है? कुछ पता नहीं चल रहा है। अब बाबा
931.92,5.88,ध्यान से देखिए ना थोड़ा ना थोड़ा सा उड़ुन
934.8,3.0,बगा।
945.36,7.99,अब
946.37,6.98,[संगीत]
959.78,9.879,[संगीत]
970.56,3.88,नींबू ओ
976.88,8.0,इसमें भी नींबू है। हां। ओए अचपट नींबू से
980.759,7.32,है। नींबू नींबू क्यों उड़े नींबू? बाप रे
984.88,5.319,ये चार गोली भर के नींबू भेजे किसने? कहां
988.079,5.12,है
990.199,5.361,भाई? इस पर तो किसी का नाम और पता भी नहीं
993.199,5.281,लिखा है।
995.56,6.04,[संगीत]
998.48,6.4,बाप रे! इस पर भी नहीं है। अभी पता कैसे
1001.6,3.28,चलेगा? किसने भेजा
1006.34,4.82,[संगीत]
1009.079,4.32,है? गणपति
1011.16,4.76,[संगीत]
1013.399,6.201,बाप्पा मैंने ये प्रार्थना की थी गणपति
1015.92,6.32,बाप्पा से कि गणपति बाप्पा काही करा। तो
1019.6,5.359,गणपति बाप्पा ने इतने सारे नींबू भेज दिए।
1022.24,4.88,गणपति बाप्पा
1024.959,4.96,प्रार्थना तो मैंने भी की थी माधवी। है
1027.12,5.76,ना? आप दोनों ने सेम प्रार्थना की थी ना
1029.919,7.441,इसलिए इतने सारे नींबू आ गए।
1032.88,7.039,गणपति बाप्पा गणपति बाप्पा
1037.36,5.52,गणपति बाप्पा ने आप दोनों की सुन ली और
1039.919,5.12,सारी टेंशन दूर कर दी।
1042.88,4.84,आई अभी तुम्हें ऑर्डर के लिए जितने नींबू
1045.039,5.361,चाहिए उतने इसमें से निकाल लो। नहीं नहीं
1047.72,4.199,नहीं माधवी ने अचार बनाना शुरू कर दिया और
1050.4,3.519,बाद में पता चला कि ये नींबू हमारे लिए
1051.919,3.441,नहीं किसी और के लिए है। और गलती से हमारे
1053.919,4.161,यहां पे आए हैं तो।
1055.36,5.439,हां। तो ठीक है ना? जितने नींबू हम यूज़
1058.08,4.719,करेंगे उतने पैसे दे देंगे। नहीं नहीं
1060.799,3.601,नहीं। जब तक पता नहीं चलता कि नींबू किसके
1062.799,4.721,"लिए आए हैं, हम इसमें से एक भी नींबू यूज़"
1064.4,5.76,"नहीं करेंगे, हां। हां, यही बराबर है। पर"
1067.52,5.12,वो पता कैसे चलेगा?
1070.16,6.16,वही तो सोच।
1072.64,5.6,"अरे हां, पता चल गया। ये नींबू जेठालाल ने"
1076.32,4.64,"भेजे हैं, माधवी।"
1078.24,4.24,"जेठा भाई! अरे, मैंने तुमको बताया ना की"
1080.96,3.2,जेठालाल को मैंने पैसे लेने से मना कर
1082.48,4.48,दिया। तो उसने नींबू बेच के मदद की है
1084.16,6.2,हमारी।
1086.96,6.24,जेठा भाई जेठा भाई अरे का जेठा
1090.36,5.319,भाई जेठाला अपन कमाल है। उसने जानबूझ के
1093.2,7.88,ना तमी बोलने वाले लोग भेजे ताकि मैं कुछ
1095.679,5.401,समझूं ही नहीं। मैं उसको फ़ करता हूं।
1102.799,5.041,बोल बोल भिड़े। हां जेठालाल अभी मेरे सवाल
1105.44,4.64,का बिना हंसी मज़ाक किए ठीक-ठीक जवाब देना।
1107.84,4.88,अच्छा ठीक से जवाब नहीं दिया तो क्या तू
1110.08,4.4,मुझे फेल कर देगा? जेठालाल मैंने अभी बोला
1112.72,4.0,ना हंसीज़ाक नहीं चाहिए फिर भी हंसीज़ाक कर
1114.48,4.4,रहे हो तुम। सॉरी सॉरी बोल बोल बोल बोल।
1116.72,4.48,जेठालाल मुझे यह जानना है कि मेरे घर पे
1118.88,4.799,चार गोनी भर के नींबू तुमने ही भेजे ना?
1121.2,7.359,चार गोनी भर के नींबू? नहीं भाई मैंने
1123.679,7.841,नहीं भेजे। तुमने नहीं भेजे? नहीं। लेकिन
1128.559,4.641,तुम्हें ऐसा क्यों लगा नींबू मैंने भेजे?
1131.52,2.88,क्योंकि अभी थोड़ी देर पहले कंपाउंड में
1133.2,4.24,मैंने तुम्हें अपनी परेशानी के बारे में
1134.4,5.84,बताया था ना। तो मुझे लगा तुमने नींबू बेच
1137.44,5.599,के मदद की है मेरी। अरे भाई मदद मतलब
1140.24,6.88,मैंने भैंसों की मदद का बोला था। नींबू की
1143.039,7.841,नहीं। अच्छा तो फिर किसने भेजे नींबू? अभी
1147.12,7.2,ये मैं कैसे बता सकता हूं दोस्त?
1150.88,6.08,तो फिर कैसे पता करूं? ये तो कबीर दास जी
1154.32,5.359,का दोहा है। कहत कबीर सब दिन गए। उलझी ना
1156.96,5.28,सुलझा मन। कहीं कबीर चेत्या नहीं। अजू सो
1159.679,4.721,पहला दिन। और ये दुहा गोकुलधाम निवासियों
1162.24,4.48,में बिल्कुल मुफीद है। बिल्कुल फिट बैठता
1164.4,5.44,है। कहते सुनते दिन निकल गए। लेकिन मन की
1166.72,4.64,उलझने सुलझती ही नहीं है। मन अभी तक होश
1169.84,4.88,"में नहीं आया, चेतना में नहीं आया। ऐसा"
1171.36,5.679,लगता है कि पहला ही दिन है ये। यही स्थिति
1174.72,4.079,भी की है। अब देखिए ना उलझने सुलझती ही
1177.039,3.76,नहीं। समस्याएं खत्म ही नहीं होती। आप
1178.799,4.401,परेशान मत होइए। बस देखते रहिए। तारक
1180.799,5.041,"मेहता का उल्टा चश्मा। देखते रहिए, हंसते"
1183.2,5.92,रहिए।
1185.84,5.839,फॉर मोर अपडेट्स सब्सक्राइब टू आवर चैनल।
1189.12,5.2,क्लिक द शो लिंक्स एंड एंजॉय वाचिंग द
1191.679,12.89,वीडियोस।
1194.32,10.249,[संगीत]
