Start Time (s),Duration (s),Text
910.8,6.929,मिलकर खूब खेले
912.15,5.579,[संगीत]
917.959,8.761,होम जो हंसता है यहां पर बस उसी की हस्ती
925.04,4.799,है।
926.72,8.479,ये गोकुल धाम है यहां पर खुशियां है और
929.839,9.44,मस्ती है। खुशियां है और मस्ती है।
935.199,8.241,जल्दी जागे दौड़े भागे।
939.279,10.081,ऐश करेंगे रेस करेंगे
943.44,9.519,थकने का अब नाम नहीं रुकने का अब काम नहीं
949.36,7.919,मस्त रहेंगे स्वस्थ रहेंगे एनर्जी का डबल
952.959,8.481,डोज़ आओ हम सब ले ले
957.279,8.641,हाथों में हाथ डालकर मिलकर खूब खेलें
961.44,9.959,हाथों में हाथ डालकर मिलकर खूब खेलें वी
965.92,5.479,एंड यू टू थ्री एंड यू
971.839,4.081,हम बच्चे बन जाएंगे।
974.41,5.39,[संगीत]
975.92,3.88,हम बड़ों को हराएंगे।
979.92,6.88,सारे करेंगे खूब धमाल। तब देखेंगे हमारा
983.36,9.14,कमाल। जब देखेंगे हमारा कमाल। जागेंगे हम
986.8,7.68,सोएंगे नहीं। चोट खाएंगे पर रोएंगे नहीं।
992.5,6.699,[प्रशंसा]
994.48,9.919,और मस्ती याद रहे भूले सब झमेले हाथों में
999.199,9.521,हाथ डालकर मिलकर खूब खेले मिलकर खूब खेले
1004.399,8.081,आओ मिलजुलकर हम इस जीवन में रंग भरे बजे
1008.72,8.4,बिगुल खुशियों के कण कण में उमंग भरे कण
1012.48,9.24,कण में उमंग भरे भूल जाए तनाव को दुखों को
1017.12,9.26,ना झेले हाथों में हाथ डालकर मिलकर खूब
1021.72,11.479,खेले दिन खेले कर
1026.38,10.02,[संगीत]
1033.199,6.961,तो प्यारे खिलाड़ियों गोकुल धाम खेल
1036.4,5.24,महोत्सव 2011 की शुरुआत हम नींबू चम्मच की
1040.16,4.48,दौड़ से
1041.64,3.0,करेंगे। बहुत
1045.0,5.48,बहुत है। अरे ये तो आता आता है। बच्चों का
1048.4,5.12,खेल है ये। अब्दुल तो नींबू चंब से रोज
1050.48,6.319,खेलता है।
1053.52,5.36,ये खेल आपको व्यक्तिगत तरीके से जीतना
1056.799,5.12,होगा।
1058.88,6.64,एंड माय डियर फ्रेंड्स यू ऑल नो दैट कि ये
1061.919,7.921,बैलेंस का खेल है। बैलेंस का हमारे जीवन
1065.52,6.0,में बहुत ही महत्व है। वेरी वेरी वेरीेंट।
1069.84,3.14,बिल्कुल सही कहा। का बैलेंस है तो फोन भी
1071.52,3.2,नहीं कर सकते।
1072.98,6.54,[संगीत]
1074.72,8.04,हे सॉरी सॉरी अगर आप पति हो तो मां और
1079.52,7.44,पत्नी के बीच में बैलेंस रखना जरूरी
1082.76,6.72,है। अगर आप स्टूडेंट हो तो पढ़ाई और खेल
1086.96,7.36,के बीच में बैलेंस रखना जरूरी
1089.48,7.64,है। और अगर आप नौकरी करते हो तो मेहनत और
1094.32,6.32,पगार के बीच में बैलेंस रखना जरूरी है।
1097.12,5.919,ट्राई। छट्टू काका बोलने का मौका मिले तो
1100.64,5.039,कब कितना बोलना चाहिए उसका भी बैलेंस रखना
1103.039,4.841,आना चाहिए।
1105.679,7.801,सेठ
1107.88,8.679,जी वो तो जैसी जिसकी सोच ए चुप रे। तू चुप
1113.48,6.12,रे। जज के साथ कैसे बात करते हैं उसका
1116.559,8.201,बैलेंस रखना भी आना चाहिए। सॉरी सॉरी बापू
1119.6,5.16,जी। मुझे सॉरी मत बोल। बाघा को सॉरी बोल।
1124.799,5.041,इट्स ओके सेठ जी।
1126.88,6.4,आज तो सभी खिलाड़ियों का नींबू चम्मच में
1129.84,7.199,बैलेंस होना बहुत जरूरी है। आप सभी को
1133.28,7.84,चम्मच में नींबू रखकर वहां सामने जो सीमा
1137.039,6.481,रेखा है। मैं तो कमाल है।
1141.12,4.559,आप तो बता रहे थे कि इनका नाम रोजी और
1143.52,4.64,लुसी है।
1145.679,4.201,पर ये लोग बता रहे हैं कि इनका नाम सीमा
1148.16,4.639,और लेखा
1149.88,5.08,है। इन्होंने नाम बदल दिया। आपको बताया कि
1152.799,6.401,नहीं?
1154.96,6.079,रोशन नहीं भाई नहीं अरे सूड़ी तू समझा नहीं
1159.2,6.839,मेरे भाई सीमा रेखा का मतलब है यहां पे
1161.039,5.0,बाउंड्री लाइन हां अच्छा
1167.12,4.4,वो क्या है ना शिक्षक साहब को बस मौका
1169.28,6.639,मिलना चाहिए तो ये सिखाना शुरू कर देते
1171.52,7.44,हैं और मैं मजाक कर रहा था ओह हो
1175.919,5.76,छोटी आजकल मजाक बहुत करता है तू आपको खुश
1178.96,5.76,करने की कोशिश करता हूं जी तो आपको ये भी
1181.679,6.0,पता होगा कि यहां लाइन लाइन तक पहुंचने से
1184.72,6.319,पहले अगर किसी भी खिलाड़ी का नींबू चम्मच
1187.679,6.24,से गिर गया तो वो खिलाड़ी आउट हो जाएगा।
1191.039,7.321,समझ गए?
1193.919,9.601,अरे भाई हम गोकुलधाम वासी हैं। हम
1198.36,9.08,लोग बचपन से ही समझदार है रे बापू जी।
1203.52,9.56,वेरी गुड वेरी गुड। तो अभी सभी खिलाड़ी
1207.44,5.64,सामने जाकर लाइन पर खड़े हो जाइए।
1214.23,3.15,[संगीत]
1220.17,5.77,[संगीत]
1228.56,7.35,[संगीत]
1236.48,4.319,दोस्तों उच्च स्वर में बजते हुए ढोल नगाड़े
1238.88,4.32,बजती हुई तालियां ये सब दिखा रहे हैं कि
1240.799,4.401,गोकुल धाम उत्साह और उमंग इस वक्त आसमान
1243.2,4.64,"पे है, चरम पे है और इसलिए उत्साह है कि"
1245.2,4.4,यह गोकुलधाम खेल महोत्सव का महासंग्राम
1247.84,4.079,प्रारंभ होने ही जा रहा है। बस घड़ी आ
1249.6,4.079,चुकी है। यह हंगामे का अश्वमेघ बस दौड़ने
1251.919,4.081,ही वाला है और आप जानते हैं जब अश्वमेघ
1253.679,4.161,दौड़ता है तो उसे कोई नहीं रोक सकता। अब
1256.0,3.679,नींबू चम्मच की रेस यहां होने वाली है
1257.84,4.719,गोकुलधाम में। सारे तैयार हैं और आप तो
1259.679,4.88,जानते हैं कि नींबू एक ऐसी चीज है जो खाने
1262.559,3.761,का स्वाद बढ़ा भी देता है और दांत भी
1264.559,4.321,खट्टे कर देता है। अब यहां ये देखना है
1266.32,4.64,किसे मिलता है जीत का स्वाद और किसके दांत
1268.88,4.32,खट्टे होते हैं हार से। वैसे एक मसला और
1270.96,4.16,भी है। नटू काका और बागा यहां पे जजेस
1273.2,4.32,बने। अब देखना ये है कि जेठालाल की जिंदगी
1275.12,4.64,में वो क्या करने वाले हैं इस खेल महोत्सव
1277.52,4.159,में? क्योंकि अब वो अगर जजेस हैं तो भाई
1279.76,4.56,"हंगामे तो होंगे ही। अब कितने हंगामे,"
1281.679,4.801,कितने सारे खेल और हर खेल के पीछे आपके घर
1284.32,4.16,में खूब सारे ठहाके और खूब सारी खुशियां।
1286.48,4.96,बस मेरे साथ देखते रहिए तारक मेहता का
1288.48,6.24,उल्टा चश्मा। जी।
1291.44,5.84,फॉर मोर अपडेट्स सब्सक्राइब टू आवर चैनल।
1294.72,5.2,क्लिक द शो लिंक्स एंड एंजॉय वाचिंग द
1297.28,12.89,वीडियोस।
1299.92,10.25,[संगीत]
